growing_site_name,address,has_chicago,add_chicago,full_address,Latitude,Longitude,location,ward,community,district_n,ownership,growing_site_website,public_contact_info,facebook,evidence_of_support_organizations,is_growing_site_fenced,is_growing_site_locked,food_producing,compost_system,is_growing_site_dormant,other_support_organization,season_extension_techniques,structures_and_features,water,choose_growing_site_types,community_garden,if_it_s_a_community_garden_is_it_collective_or_allotment,neighborhood
Jahn Elementary School (Friedrich Ludwig),3149 W Belmont Ave,TRUE,Chicago IL,3149 W Belmont Ave Chicago IL,41.9392007,-87.6752899,"[41.9392007,-87.6752899]",32,NORTH CENTER,12,Chicago Public Schools,,,,The Kitchen Community,TRUE,FALSE,TRUE,FALSE,FALSE,,,,,School Garden  Ornamental / Beautification,FALSE,,
Prescott Elementary School (William H.),1632 W Wrightwood Ave,TRUE,Chicago IL,1632 W Wrightwood Ave Chicago IL,41.9290604,-87.6692389,"[41.9290604,-87.6692389]",32,LINCOLN PARK,12,,,,,,,,TRUE,FALSE,FALSE,,,,,School Garden  Ornamental / Beautification  Habitat / Conservation / Prairie,FALSE,,
Pulaski Academy Garden (Casmir),2230 W McLean Ave,TRUE,Chicago IL,2230 W McLean Ave Chicago IL,41.9188445,-87.683846,"[41.9188445,-87.683846]",32,LOGAN SQUARE,8,Chicago Public Schools,,,,The Kitchen Community,TRUE,FALSE,TRUE,TRUE,FALSE,,,,,School Garden,FALSE,,
Neighbors Park and Garden,2533 N Sacramento Ave  Chicago  IL 60647  USA,FALSE,,2533 N Sacramento Ave  Chicago  IL 60647  USA,41.9276551,-87.7020967,"[41.9276551,-87.7020967]",32,LOGAN SQUARE,8,Chicago Park District,,,,,FALSE,FALSE,TRUE,TRUE,FALSE,,,Compost System  Compost System  Compost System  Compost System  Seating Area  Seating Area  Seating Area  Shed / Storage box  Shed / Storage box  Teaching Area,On site water source,Community Garden  Community Garden  Community Garden  Habitat / Conservation / Prairie  Habitat / Conservation / Prairie  Ornamental / Beautification,TRUE,,
The Bucktown Green,1724 N Wilmot Ave  Chicago  IL 60647  USA,FALSE,,1724 N Wilmot Ave  Chicago  IL 60647  USA,41.912918,-87.680251,"[41.912918,-87.680251]",32,WEST TOWN,12,NeighborSpace,,,,,FALSE,FALSE,FALSE,FALSE,FALSE,Bucktown Community Organization,,,No apparent water source,Community Garden,TRUE,Collective,
Armitage Richmond Garden,2917 W Armitage Ave  Chicago  IL 60647  USA,FALSE,,2917 W Armitage Ave  Chicago  IL 60647  USA,41.9172886,-87.6999843,"[41.9172886,-87.6999843]",1,LOGAN SQUARE,8,,,,,,TRUE,FALSE,TRUE,,FALSE,Urban Habitat Chicago,,Compost System  Grill / Cooking Station  Fire Pit  Seating Area  Shed / Storage box  Electricity Outlet,Rain collection system ( rain barrels  cisterns)  Hose connected to private property,Community Garden  Ornamental / Beautification,,,
Eckhart Park Senior Apartments,847 N Greenview Ave,TRUE,Chicago IL,847 N Greenview Ave Chicago IL,41.8975959,-87.6645134,"[41.8975959,-87.6645133999999]",1,WEST TOWN,2,,,,,,TRUE,FALSE,TRUE,,FALSE,,,,On site water source,Community Garden  (Assisted) Housing,,Collective,
El Yunque Community Garden,1459 N Artesian Ave,TRUE,Chicago IL,1459 N Artesian Ave Chicago IL,41.9084303,-87.6881205,"[41.9084303,-87.6881205]",1,WEST TOWN,8,NeighborSpace,http://neighbor-space.org/2012/06/15/el-yunque/,elyunquegarden@gmail.com,https://www.facebook.com/ElYunqueGarden?ref=br_tf,,TRUE,TRUE,TRUE,TRUE,FALSE,,,Compost System  Seating Area  Artwork / Sculptures  Information Kiosk,On site water source,Community Garden,TRUE,Allotment,
Esperanza Community Garden,520 N Marshfield Ave,TRUE,Chicago IL,520 N Marshfield Ave Chicago IL,41.8914639,-87.6688023,"[41.8914639,-87.6688023]",1,WEST TOWN,2,,,,,,TRUE,TRUE,TRUE,,FALSE,,,Seating Area  Shed / Storage box  Artwork / Sculptures,On site water source,School Garden,,Allotment  Collective,
Flower/Lucy Playlot Park,2554 W Moffat St,TRUE,Chicago IL,2554 W Moffat St Chicago IL,41.9148178,-87.6919416,"[41.9148178,-87.6919415999999]",1,LOGAN SQUARE,8,Chicago Park District,,,,,TRUE,FALSE,TRUE,,FALSE,,,Compost System  Seating Area  Play Area,No apparent water source,Community Garden  Demo / Training / Program,,Collective,
Frankie Machine Garden,1800 W Haddon Ave,TRUE,Chicago IL,1800 W Haddon Ave Chicago IL,41.9025748,-87.6725222,"[41.9025748,-87.6725222]",1,WEST TOWN,2,NeighborSpace,http://neighbor-space.org/2011/05/20/frankie-machine-garden/,,https://www.facebook.com/FrankieMachineCommunityGarden?ref=br_tf,,TRUE,TRUE,TRUE,,FALSE,,Cold Frame,Compost System  Seating Area  Covered Area,On site water source,Community Garden  Food Donation  Ornamental / Beautification  Habitat / Conservation / Prairie,,Collective,
GreenHouse Garden,1100 N Wood St,TRUE,Chicago IL,1100 N Wood St Chicago IL,41.9016331,-87.6726699,"[41.9016331,-87.6726699]",1,WEST TOWN,2,NeighborSpace,http://neighbor-space.org/2011/05/20/greenhouse-garden/,,https://www.facebook.com/tomandwood/,,FALSE,FALSE,TRUE,TRUE,FALSE,,,Covered Area  Seating Area  Gazebo,On site water source,Urban Farm  Park,,Allotment  Collective,
Hermitage Triangle Garden,1722 W Potomac Ave,TRUE,Chicago IL,1722 W Potomac Ave Chicago IL,41.9048607,-87.671105,"[41.9048607,-87.671105]",1,WEST TOWN,12,NeighborSpace,http://neighbor-space.org/2012/06/23/hermitage-triangle-garden/,,https://www.facebook.com/pages/Hermitage-Street-Community-Garden/406962475984351,,FALSE,FALSE,TRUE,,FALSE,,,,On site water source,Community Garden,,Unclear,
Humble Parquito,1630 N Richmond St,TRUE,Chicago IL,1630 N Richmond St Chicago IL,41.9112081,-87.7005641,"[41.9112081,-87.7005641]",1,WEST TOWN,8,,,,https://www.facebook.com/humble.parquito,,TRUE,FALSE,TRUE,,TRUE,,Cold Frame  Cold Tunnel,Compost System  Grill / Cooking Station  Fire Pit  Seating Area  Performance Area  Shed / Storage box  Artwork / Sculptures  Water Management  Educational Signage  Covered Area,City Fire Hydrant  Rain collection system ( rain barrels  cisterns),Community Garden  Ornamental / Beautification,,Unclear,
Met West Community Garden,1712 W Ohio St,TRUE,Chicago IL,1712 W Ohio St Chicago IL,41.8926237,-87.6701914,"[41.8926237,-87.6701914]",1,WEST TOWN,2,,,,https://www.facebook.com/metwestgarden,,TRUE,TRUE,TRUE,,FALSE,,,Compost System  Seating Area  Covered Area,On site water source,Community Garden,,Collective,
Puerto Rican Cultural Center Garden,2425 West North Ave,TRUE,Chicago IL,2425 West North Ave Chicago IL,41.9100429,-87.6882328,"[41.9100429,-87.6882328]",1,WEST TOWN,8,,http://prcc-chgo.org/,,,,TRUE,TRUE,TRUE,,FALSE,Puerto Rican Cultural Center,,Seating Area,No apparent water source,Community Garden  Demo / Training / Program,,Allotment,
Farmessori,1112 N Wood St  Chicago  IL 60622,FALSE,,1112 N Wood St  Chicago  IL 60622,41.9019142,-87.6726431,"[41.9019142,-87.6726431]",1,WEST TOWN,2,Private,https://www.nnms.org/academics/farmessori,jphillips@nnms.org,https://www.facebook.com/pages/NNMS-Farmessori/507951425887144,,TRUE,TRUE,TRUE,FALSE,FALSE,Near North Montessori,Hoop house,Shed / Storage box  Fire Pit  Seating Area,On site water source,Community Garden  School Garden,FALSE,Collective,
Snowberry Playlot Park/Green Growers Children's Garden,1851 W Huron St,TRUE,Chicago IL,1851 W Huron St Chicago IL,41.8939276,-87.6742171,"[41.8939276,-87.6742170999999]",1,WEST TOWN,2,Chicago Park District,http://www.chicagoparkdistrict.com/parks/Snowberry-Playlot-Park/,,,,TRUE,FALSE,TRUE,,FALSE,,,Compost System,On site water source  Rain collection system ( rain barrels  cisterns),Community Garden,,,
Thomas St. Community Garden,2655 W Thomas St,TRUE,Chicago IL,2655 W Thomas St Chicago IL,41.9008952,-87.6940311,"[41.9008952,-87.6940310999999]",1,WEST TOWN,8,NeighborSpace,http://neighbor-space.org/2012/06/23/thomas-street-community-garden/,thomasstreetgarden@gmail.com,https://www.facebook.com/thomasstreetgarden/,,TRUE,TRUE,TRUE,TRUE,FALSE,,,Compost System  Seating Area  Water Management,On site water source,Community Garden,,Collective,
Wicker Park Senior Apartments,2020 W Schiller St,TRUE,Chicago IL,2020 W Schiller St Chicago IL,41.9073995,-87.6785775,"[41.9073995,-87.6785775]",1,WEST TOWN,12,Chicago Park District,http://www.yellowpages.com/chicago-il/mip/wicker-park-senior-apts-538516,(773) 782-4329 2020,https://www.facebook.com/pages/Wicker-Park-Chicago-Illinois/327264190704453?fref=ts,Chicago Park District,TRUE,FALSE,TRUE,FALSE,FALSE,,,Seating Area,On site water source  Hose connected to private property,Community Garden  (Assisted) Housing,FALSE,Allotment,
Clemente High School (Roberto),1147 N Western Ave,TRUE,Chicago IL,1147 N Western Ave Chicago IL,41.9026169,-87.6861292,"[41.9026169,-87.6861292]",1,WEST TOWN,2,,,,,,,,FALSE,FALSE,FALSE,,,,,School Garden  Ornamental / Beautification,FALSE,Allotment,
De Diego Community Academy (Jose),1244 N Oakley,TRUE,Chicago IL,1244 N Oakley Chicago IL,41.9042414,-87.6846202,"[41.9042414,-87.6846202]",1,WEST TOWN,12,Chicago Public Schools,,,,The Kitchen Community,FALSE,FALSE,TRUE,FALSE,FALSE,,,,,School Garden,FALSE,,
Goethe Elementary School Garden (Johann W. von),2236 N Rockwell St Chicago IL,FALSE,,2236 N Rockwell St Chicago IL,41.9226426,-87.693217,"[41.9226426,-87.6932169999999]",1,LOGAN SQUARE,8,,,,,,,,FALSE,FALSE,FALSE,,,,,,FALSE,,
LaSalle II (formerly Andersen) - Jardin de los Ninos,1148 N Honore St,TRUE,Chicago IL,1148 N Honore St Chicago IL,41.9024478,-87.6739089,"[41.9024478,-87.6739089]",1,WEST TOWN,2,,,,,,,,TRUE,FALSE,FALSE,,,,,School Garden,FALSE,,
Ogden HS/Carpenter School Garden (Philo),1250 W Erie St Chicago IL,FALSE,,1250 W Erie St Chicago IL,41.8937679,-87.658807,"[41.8937679,-87.658807]",1,WEST TOWN,2,,,,,,,,FALSE,FALSE,FALSE,,,,,,FALSE,,
Otis Elementary School Garden (James),525 N Armour St Chicago IL,FALSE,,525 N Armour St Chicago IL,41.8918832,-87.6651255,"[41.8918832,-87.6651255]",1,WEST TOWN,2,Chicago Public Schools,,,,The Kitchen Community,TRUE,FALSE,TRUE,FALSE,FALSE,,,,,School Garden,FALSE,,
Pritzker Elementary School Garden (A.N.),2009 W Schiller St,TRUE,Chicago IL,2009 W Schiller St Chicago IL,41.9068819,-87.6779558,"[41.9068818999999,-87.6779557999999]",1,WEST TOWN,12,,,,,,,,TRUE,FALSE,FALSE,,,,,School Garden  Habitat / Conservation / Prairie,FALSE,,
Sabin Elementary Magnet School Garden (Albert R.),2216 W Hirsch St,TRUE,Chicago IL,2216 W Hirsch St Chicago IL,41.9073571,-87.6829217,"[41.9073571,-87.6829217]",1,WEST TOWN,12,,,,,,,,FALSE,FALSE,FALSE,,,,,School Garden  Ornamental / Beautification,FALSE,,
Talcott Elementary School Garden (Mancel),1840 W Ohio St,TRUE,Chicago IL,1840 W Ohio St Chicago IL,41.8926909,-87.6742248,"[41.8926909,-87.6742248]",1,WEST TOWN,2,,,,,,,,FALSE,FALSE,FALSE,,,,,School Garden,FALSE,,
Wells High School (William H.)/ Wildlife Garden,936 N Ashland Ave,TRUE,Chicago IL,936 N Ashland Ave Chicago IL,41.8989343,-87.668018,"[41.8989343,-87.6680179999999]",1,WEST TOWN,2,,,,,,,,TRUE,FALSE,FALSE,,,,,School Garden,FALSE,,
Yates Elementary School (Richard),1839 N Richmond St,TRUE,Chicago IL,1839 N Richmond St Chicago IL,41.9148991,-87.6996329,"[41.9148991,-87.6996329]",1,LOGAN SQUARE,8,,,,,,,,TRUE,FALSE,FALSE,,,,,School Garden  Ornamental / Beautification  Habitat / Conservation / Prairie,FALSE,,
Carpenter Pizza Garden,1250 W Erie St  Chicago  IL 60642  USA,FALSE,,1250 W Erie St  Chicago  IL 60642  USA,41.8937679,-87.658807,"[41.8937679,-87.658807]",1,WEST TOWN,2,,CommunityGarden.org,Eileen Gassman: Mamarama@aol.com,,Greencorps Chicago,,,TRUE,,FALSE,,,,,Community Garden  Community Garden  School Garden,TRUE,,
The Hero of Thyme,2858 W Belden Ave  Chicago  IL 60647  USA,FALSE,,2858 W Belden Ave  Chicago  IL 60647  USA,41.9235195,-87.6996522,"[41.9235195,-87.6996522]",1,LOGAN SQUARE,8,Private,,the.hero.of.thyme.chicago@gmail.com,,,TRUE,FALSE,TRUE,TRUE,FALSE,,,,Rain collection system ( rain barrels  cisterns)  Rain collection system ( rain barrels  cisterns)  Hose connected to private property,Community Garden  Community Garden  Community Garden  Demo / Training / Program  Demo / Training / Program  Food Donation,TRUE,Unclear,
The Roof Crop (LG Construction),1237 N Milwaukee Ave  Chicago  IL 60622  USA,FALSE,,1237 N Milwaukee Ave  Chicago  IL 60622  USA,41.9044582,-87.6678056,"[41.9044582,-87.6678056]",1,WEST TOWN,12,Private,https://www.theroofcrop.com/,(312) 690-7046,https://www.facebook.com/THEROOFCROP/,,,TRUE,TRUE,,FALSE,,,,Irrigation System,Rooftop,FALSE,Allotment,
Edna White Century Garden,1812 W Monterey Ave,TRUE,Chicago IL,1812 W Monterey Ave Chicago IL,41.6915535,-87.6678705,"[41.6915535,-87.6678704999999]",19,MORGAN PARK,11,NeighborSpace,http://ednawhite.blogspot.com/,,,,FALSE,FALSE,TRUE,,FALSE,,,Compost System  Seating Area  Shed / Storage box  Handicap accessible bed  Artwork / Sculptures  Electricity Outlet  Gazebo,On site water source,Community Garden  Food Donation  Ornamental / Beautification  Habitat / Conservation / Prairie,,,
Morgan Park Academy Garden,2153 W 111th St,TRUE,Chicago IL,2153 W 111th St Chicago IL,41.6915265,-87.6756552,"[41.6915264999999,-87.6756552]",19,MORGAN PARK,11,,,,,,FALSE,FALSE,TRUE,,FALSE,Morgan Park Academy,,Compost System  Fire Pit  Seating Area,Hose connected to private property,School Garden,,Allotment  Collective,
Mount Greenwood Children's Garden,3807 W 111th St,TRUE,Chicago IL,3807 W 111th St Chicago IL,41.6913378,-87.7161776,"[41.6913378,-87.7161776]",19,MOUNT GREENWOOD,11,Chicago Park District,https://communitygarden.org/find-a-garden/gardens/mt-greenwood-childrens-garden/,,,U of I Extension,,,FALSE,,FALSE,,,,,Community Garden  Demo / Training / Program,,Collective,
Barnard Elementary School (Alice L.),10354 S Charles,TRUE,Chicago IL,10354 S Charles Chicago IL,41.705352,-87.6585558,"[41.705352,-87.6585558]",19,BEVERLY,11,,,,,,,,FALSE,FALSE,FALSE,,,,,School Garden  Ornamental / Beautification,FALSE,,
Beacon Therapeutic School,10650 S Longwood,TRUE,Chicago IL,10650 S Longwood Chicago IL,41.6995699,-87.6721333,"[41.6995699,-87.6721333]",19,BEVERLY,11,,,,,,,,FALSE,FALSE,FALSE,,,,,School Garden  Ornamental / Beautification,FALSE,,
Cassell Elementary School (George F.),11314 S Spaulding,TRUE,Chicago IL,11314 S Spaulding Chicago IL,41.6874658,-87.7037986,"[41.6874658,-87.7037986]",19,MOUNT GREENWOOD,11,,,,,,,,FALSE,FALSE,FALSE,,,,,School Garden  Ornamental / Beautification,FALSE,,
Chicago High School for Agricultural Sciences,3857 W 111th St,TRUE,Chicago IL,3857 W 111th St Chicago IL,41.690225,-87.7176465,"[41.690225,-87.7176465]",19,MOUNT GREENWOOD,11,,www.chicagoagr.org/index.jsp,,,,,,TRUE,FALSE,FALSE,,,Seating Area  Shed / Storage box  Washing Area / Sinks,On site water source,School Garden,FALSE,,
Clissold Elementary School (Henry R.),2350 W 110th Pl,TRUE,Chicago IL,2350 W 110th Pl Chicago IL,41.6934541,-87.6806109,"[41.6934541,-87.6806108999999]",19,MORGAN PARK,11,,,,,,,,FALSE,FALSE,FALSE,,,,,School Garden  Habitat / Conservation / Prairie,FALSE,,
Esmond Elementary School,1865 W Montvale Ave,TRUE,Chicago IL,1865 W Montvale Ave Chicago IL,41.6892928,-87.6693037,"[41.6892928,-87.6693037]",19,MORGAN PARK,11,Chicago Public Schools,,,,The Kitchen Community,TRUE,TRUE,TRUE,FALSE,FALSE,,,Artwork / Sculptures  Covered Area  Seating Area  Teaching Area  Handicap accessible bed,Irrigation System  On site water source,School Garden,FALSE,,
Keller Elementary Gifted Magnet School Garden (Annie),3020 W 108th St,TRUE,Chicago IL,3020 W 108th St Chicago IL,41.6974763,-87.6968995,"[41.6974763,-87.6968995]",19,MOUNT GREENWOOD,11,,,,,,,,FALSE,FALSE,FALSE,,,,,School Garden  Ornamental / Beautification  Habitat / Conservation / Prairie,FALSE,,
Kellogg Elementary School Garden (Kate S.),9241 S Leavitt St,TRUE,Chicago IL,9241 S Leavitt St Chicago IL,41.7252448,-87.6768312,"[41.7252448,-87.6768312]",19,BEVERLY,11,,,,,,,,TRUE,FALSE,FALSE,,,,,School Garden  Ornamental / Beautification,FALSE,,
Morgan Park High School,1744 W Pryor,TRUE,Chicago IL,1744 W Pryor Chicago IL,41.6920075,-87.6660539,"[41.6920075,-87.6660539]",19,MORGAN PARK,11,,,,,,,,FALSE,FALSE,FALSE,,,,,School Garden,FALSE,,
Mount Greenwood Elementary School,10841 S Homan Ave,TRUE,Chicago IL,10841 S Homan Ave Chicago IL,41.6957383,-87.7053303,"[41.6957383,-87.7053303]",19,MOUNT GREENWOOD,11,,,,,,,,FALSE,FALSE,FALSE,,,,,,FALSE,,
Sutherland Elementary School Garden (Elizabeth H.),10015 S Leavitt Street,TRUE,Chicago IL,10015 S Leavitt Street Chicago IL,41.7112772,-87.6765122,"[41.7112772,-87.6765121999999]",19,BEVERLY,11,,,,,,,,FALSE,FALSE,FALSE,,,,,School Garden  Ornamental / Beautification,FALSE,,
Vick Early Childhood & Family Center Garden (Barbara),2554 West 113th St,TRUE,Chicago IL,2554 West 113th St Chicago IL,41.688637,-87.6857182,"[41.688637,-87.6857182]",19,MORGAN PARK,11,,,,,,,,FALSE,FALSE,FALSE,,,,,School Garden  Ornamental / Beautification,FALSE,,
Pullman Community Apiary,11057 S Cottage Grove,TRUE,Chicago IL,11057 S Cottage Grove Chicago IL,41.6931556,-87.6087265,"[41.6931556,-87.6087265]",9,CHICAGO,4,,http://www.facebook.com/groups/171705946209846/,,,,,,TRUE,FALSE,FALSE,,,,,Urban Farm,FALSE,,
Walk In Peace Garden,11417 S Michigan Ave,TRUE,Chicago IL,11417 S Michigan Ave Chicago IL,41.686513,-87.620521,"[41.686513,-87.620521]",9,ROSELAND,5,,,,,,FALSE,FALSE,FALSE,,FALSE,RCDC Roseland Community Development Corporation,,,,Community Garden,,,
Guerrilla Garden,12911 S Eggleston Ave,TRUE,Chicago IL,12911 S Eggleston Ave Chicago IL,41.6595715,-87.6325066,"[41.6595715,-87.6325066]",9,WEST PULLMAN,5,,,,,,FALSE,FALSE,TRUE,,FALSE,,,,City Fire Hydrant  Hose connected to private property,Community Farm,,,
Passion of Pullman Organic Garden,10701 S Champlain Ave,TRUE,Chicago IL,10701 S Champlain Ave Chicago IL,41.6999736,-87.6070782,"[41.6999736,-87.6070781999999]",9,CHICAGO,4,,http://thehouseofchloeinc.org/,,,,FALSE,FALSE,TRUE,,FALSE,,,Compost System,Hose connected to private property,Community Garden  Pantry Garden  Ornamental / Beautification,,Allotment,
Pullman Urban Gardens,11057 S Cottage Grove Ave,TRUE,Chicago IL,11057 S Cottage Grove Ave Chicago IL,41.6931556,-87.6087265,"[41.6931556,-87.6087265]",9,CHICAGO,4,Pullman State Historic Site,http://www.hpgc.org/,Via Facebook,https://www.facebook.com/groups/PullmanUrbanGardens/,,TRUE,TRUE,TRUE,TRUE,FALSE,Pullman National Monument  Historic Pullman Beekeepers,Cold Frame,Play Area  Fire Pit  Artwork / Scultptures  Teaching Area  Seating Area  Handicap accessible bed,Rain collection system ( rain barrels  cisterns),Urban Farm  Community Garden  Orchard,TRUE,Collective,
The Cooperation Operation,657 E 114th St  Chicago  IL 60628  USA,FALSE,,657 E 114th St  Chicago  IL 60628  USA,41.6866099,-87.6059035,"[41.6866099,-87.6059035]",9,CHICAGO,4,City of Chicago,cooperationoperation.org,,https://www.facebook.com/pages/The-Cooperation-Operation/601185756574486,,TRUE,FALSE,TRUE,TRUE,FALSE,Cooperation Operation,Cold Frame  Hoop house,Compost System  Grill / Cooking Station  Fire Pit  Seating Area  Artwork / Sculptures  Handicap accessible bed  Play Area  Teaching Area  Washing Area / Sinks  Shed / Storage box,City Fire Hydrant  Hose connected to private property,Community Garden  Ornamental / Beautification  Demo / Training / Program  Food Donation  Habitat / Conservation / Prairie  Urban Agriculture Organization  Pantry Garden,TRUE,Allotment,
Roseland Community Development Corporation,11409 S Michigan Ave,TRUE,Chicago IL,11409 S Michigan Ave Chicago IL,41.6867649,-87.6205855,"[41.6867649,-87.6205854999999]",9,ROSELAND,5,,,,,,TRUE,TRUE,TRUE,,FALSE,RCDC Roseland Community Development Corporation,,Compost System  Farm Stand  Seating Area  Shed / Storage box  Covered Area,Hose connected to private property,Demo / Training / Program,,Collective,
Roseland Community Peace Garden,10356 S Wabash Ave,TRUE,Chicago IL,10356 S Wabash Ave Chicago IL,41.7055557,-87.622561,"[41.7055557,-87.6225609999999]",9,ROSELAND,5,,,,,,TRUE,TRUE,TRUE,,FALSE,,,Compost System  Seating Area,Hose connected to private property,Community Garden  Food Donation,,Collective,
,607 E 134th Pl,TRUE,Chicago IL,607 E 134th Pl Chicago IL,41.650874,-87.607104,"[41.6508739999999,-87.6071039999999]",9,RIVERDALE,5,,,,,,FALSE,FALSE,TRUE,,FALSE,,Hoop house,,,Community Garden,,Collective,
,348 E 116th St,TRUE,Chicago IL,348 E 116th St Chicago IL,41.6829133,-87.6148116,"[41.6829133,-87.6148116]",9,WEST PULLMAN,5,,,,,,TRUE,FALSE,TRUE,,FALSE,,,,,Community Garden,,Allotment  Collective,
,9338 S Indiana Ave,TRUE,Chicago IL,9338 S Indiana Ave Chicago IL,41.7244002,-87.6190513,"[41.7244002,-87.6190513]",9,ROSELAND,4,,,,,,,,TRUE,,FALSE,,,,,,,Collective,
,9400 S Cottage Grove,TRUE,Chicago IL,9400 S Cottage Grove Chicago IL,41.7239866,-87.6048644,"[41.7239866,-87.6048644]",9,CHATHAM,4,,,,,,FALSE,FALSE,FALSE,,TRUE,,,,,Community Garden,,,
Bennett Elementary School (Frank I.),10115 S Prairie Ave,TRUE,Chicago IL,10115 S Prairie Ave Chicago IL,41.7103104,-87.6169239,"[41.7103104,-87.6169238999999]",9,ROSELAND,5,,,,,,,,FALSE,FALSE,FALSE,,,,,School Garden,FALSE,,
Carver Military Academy HS Beautification Club (George Washington),13100 S Doty,TRUE,Chicago IL,13100 S Doty Chicago IL,41.6566132,-87.5894541,"[41.6566132,-87.5894541]",9,RIVERDALE,4,,,,,,,,FALSE,FALSE,FALSE,,,,,School Garden,FALSE,,
Carver Primary School (George Washington),901 E 133rd Pl Chicago IL,FALSE,,901 E 133rd Pl Chicago IL,41.6531639,-87.6009995,"[41.6531639,-87.6009995]",9,RIVERDALE,5,,,,,,,,FALSE,FALSE,FALSE,,,,,,FALSE,,
Chicago State University - Aquaponics Division,9501 S King Dr,TRUE,Chicago IL,9501 S King Dr Chicago IL,41.7196016,-87.611129,"[41.7196016,-87.6111289999999]",9,ROSELAND,4,,www.csu.edu,,,,,,TRUE,FALSE,FALSE,,,,,School Garden,FALSE,,
Cullen School,10650 S Eberhart Ave,TRUE,Chicago IL,10650 S Eberhart Ave Chicago IL,41.7002655,-87.6116255,"[41.7002655,-87.6116255]",9,ROSELAND,5,Chicago Public Schools,,,,The Kitchen Community,,,TRUE,FALSE,FALSE,,,,,School Garden,FALSE,,
DuBois Elementary School (William E. B.),330 E 133rd St Chicago IL,FALSE,,330 E 133rd St Chicago IL,41.6540398,-87.6142411,"[41.6540398,-87.6142411]",9,RIVERDALE,5,,,,,,,,FALSE,FALSE,FALSE,,,,,,FALSE,,
Gillespie Elementary School (Frank L.),9301 S State St Chicago IL,FALSE,,9301 S State St Chicago IL,41.7251984,-87.6231392,"[41.7251984,-87.6231392]",9,ROSELAND,4,Chicago Public Schools,,,,The Kitchen Community,TRUE,TRUE,TRUE,FALSE,FALSE,,,Artwork / Sculptures  Seating Area  Teaching Area  Handicap accessible bed  Covered Area,Irrigation System  On site water source,School Garden,FALSE,,
Gwendolyn Brooks College Preparatory Academy,250 E 111th St,TRUE,Chicago IL,250 E 111th St Chicago IL,41.6941813,-87.6158923,"[41.6941813,-87.6158923]",9,ROSELAND,5,Chicago Public Schools,,,,The Kitchen Community,FALSE,FALSE,TRUE,FALSE,FALSE,,,,,School Garden,FALSE,,
Harlan Community Academy HS (John M.),9650-52 S Michigan,TRUE,Chicago IL,9650-52 S Michigan Chicago IL,41.7187073,-87.6213503,"[41.7187073,-87.6213503]",9,ROSELAND,4,,,,,,,,FALSE,FALSE,FALSE,,,,,School Garden,FALSE,,
McDade Classical (James E.),8801 S Indiana Ave Chicago IL,FALSE,,8801 S Indiana Ave Chicago IL,41.7343416,-87.6186754,"[41.7343416,-87.6186754]",9,CHATHAM,4,,,,,,,,FALSE,FALSE,FALSE,,,,,,FALSE,,
Owens Elementary School,12302 S. State St,TRUE,Chicago IL,12302 S. State St Chicago IL,41.6705549,-87.6231873,"[41.6705549,-87.6231873]",9,WEST PULLMAN,5,Chicago Public Schools,,,,The Kitchen Community,TRUE,TRUE,TRUE,FALSE,FALSE,,,,,School Garden,FALSE,,
Poe Classical Elementary School (Edgar Allen),10538 S Langley Ave,TRUE,Chicago IL,10538 S Langley Ave Chicago IL,41.7024754,-87.60645,"[41.7024754,-87.60645]",9,CHICAGO,4,,,,,,,,FALSE,FALSE,FALSE,,,,,,FALSE,,
Altgeld Gardens Farm,130th Street and Ellis  Chicago,FALSE,,130th Street and Ellis  Chicago,41.6593836,-87.5977929,"[41.6593836,-87.5977929]",9,RIVERDALE,5,,www.growingpower.org,,,Growing Power,,,TRUE,FALSE,FALSE,,Hoop house,,,Urban Farm  Urban Agriculture Organization,FALSE,,
Abbott Park Harvest Garden,49 E 95th St  Chicago  IL 60619  USA,FALSE,,49 E 95th St  Chicago  IL 60619  USA,41.7208959,-87.6223174,"[41.7208959,-87.6223174]",9,ROSELAND,4,Chicago Park District,,,,,FALSE,FALSE,TRUE,TRUE,FALSE,,,Teaching Area,On site water source,,FALSE,,
Pullman Gateway Garden,647 E 111th St  Chicago  IL 60628  USA,FALSE,,647 E 111th St  Chicago  IL 60628  USA,41.6926484,-87.6063017,"[41.6926484,-87.6063017]",9,CHICAGO,4,NeighborSpace,http://neighbor-space.org/2012/06/05/pullman-gateway-garden/,,,,FALSE,FALSE,,,FALSE,,,,,Ornamental / Beautification,TRUE,,
Hanson Park Elementary School Garden,5411 W Fullerton Ave,TRUE,Chicago IL,5411 W Fullerton Ave Chicago IL,41.9231977,-87.7621715,"[41.9231977,-87.7621715]",36,CHICAGO,8,,,,,,,,FALSE,FALSE,FALSE,,,,,School Garden  Ornamental / Beautification,FALSE,,
Northwest Middle School/Belmont Cragin,5252 W Palmer St,TRUE,Chicago IL,5252 W Palmer St Chicago IL,41.9210253,-87.7581127,"[41.9210253,-87.7581127]",36,CHICAGO,8,,,,,,,,TRUE,FALSE,FALSE,,,,,School Garden  Ornamental / Beautification  Habitat / Conservation / Prairie,FALSE,,
Prieto Math and Science Elementary (Dr. Jorge),2231 N Central Ave,TRUE,Chicago IL,2231 N Central Ave Chicago IL,41.9209951,-87.7651761,"[41.9209951,-87.7651760999999]",36,CHICAGO,8,,,,,,,,FALSE,FALSE,FALSE,,,,,School Garden,FALSE,,
Prosser Career Academy High School,2148 N Long Ave,TRUE,Chicago IL,2148 N Long Ave Chicago IL,41.9193851,-87.761876,"[41.9193851,-87.761876]",36,CHICAGO,8,,,,,,,,FALSE,FALSE,FALSE,,,,,,FALSE,,
Steinmetz Academic Centre High School (Charles P.),3030 N Mobile Ave Chicago IL,FALSE,,3030 N Mobile Ave Chicago IL,41.935833,-87.7834044,"[41.935833,-87.7834044]",36,CHICAGO,12,,,,,,,,FALSE,FALSE,FALSE,,,,,,FALSE,,
Lloyd Elementary School (Henry D.),2103 N Lamon Ave Chicago IL,FALSE,,2103 N Lamon Ave Chicago IL,41.9190964,-87.7473455,"[41.9190964,-87.7473455]",36,CHICAGO,8,,,,,,,,FALSE,FALSE,FALSE,,,,,School Garden  Ornamental / Beautification  Habitat / Conservation / Prairie,FALSE,,
North Grand High School,4338 W Wabansia Ave,TRUE,Chicago IL,4338 W Wabansia Ave Chicago IL,41.9124219,-87.7349604,"[41.9124219,-87.7349604]",36,HUMBOLDT PARK,8,,,,,,,,TRUE,FALSE,FALSE,,,,,School Garden  Ornamental / Beautification  Habitat / Conservation / Prairie,FALSE,,
