growing_site_name,address,has_chicago,add_chicago,full_address,Latitude,Longitude,location,ward,community,district_n,ownership,growing_site_website,public_contact_info,facebook,evidence_of_support_organizations,is_growing_site_fenced,is_growing_site_locked,food_producing,compost_system,is_growing_site_dormant,other_support_organization,season_extension_techniques,structures_and_features,water,choose_growing_site_types,community_garden,if_it_s_a_community_garden_is_it_collective_or_allotment,neighborhood
4400 Maypole Block Club Garden,222 N Kenneth Ave  Chicago  IL 60624  USA,FALSE,,222 N Kenneth Ave  Chicago  IL 60624  USA,41.8844146,-87.7369759,"[41.8844146,-87.7369758999999]",28,CHICAGO,1,NeighborSpace,http://neighbor-space.org/2011/05/19/4400-maypole-block-club-garden/,,,NeighborSpace,,,FALSE,,FALSE,,,,,,,,
Garfield Park Conservatory,300 N Central Park Ave  Chicago  IL 60624,FALSE,,300 N Central Park Ave  Chicago  IL 60624,41.8863474,-87.7177234,"[41.8863474,-87.7177234]",28,CHICAGO,1,Chicago Park District,www.garfieldconservatory.org,Mattie Wilson mwilson@garfieldpark.org,https://www.facebook.com/GarfieldParkConservatory,,TRUE,TRUE,TRUE,TRUE,FALSE,Owned by Chicago Park District  some portions overseen by the Garfield Park Conservatory Alliance non-profit partner.,Cold Frame  Cold Tunnel  Greenhouse,Water Management  Washing Area / Sinks  Shed / Storage box  Play Area  Information Kiosk  Electricity Outlet  Covered Area  Artwork / Scultptures  Water Feature (ponds  fountain)  Teaching Area  Seating Area  Performance Area  Handicap accessible bed  Educational Signage,Irrigation System  On site water source  Rain collection system ( rain barrels  cisterns),,,,
Jamieson Elementary School (Minnie Mars),5650 N Mozart,TRUE,Chicago IL,5650 N Mozart Chicago IL,41.9837696,-87.7009418,"[41.9837696,-87.7009418]",40,WEST RIDGE,10,,,,,,,,FALSE,FALSE,FALSE,,,,,School Garden,FALSE,,
St. Matthias School Garden,4910 N. Claremont Avenue,TRUE,Chicago IL,4910 N. Claremont Avenue Chicago IL,41.9708564,-87.6881197,"[41.9708564,-87.6881197]",40,LINCOLN SQUARE,12,,,,,,,,TRUE,FALSE,FALSE,,,,,School Garden,FALSE,,
Bowmanville Community Garden,5386 N Bowmanville Ave,TRUE,Chicago IL,5386 N Bowmanville Ave Chicago IL,41.979223,-87.686164,"[41.979223,-87.6861639999999]",40,LINCOLN SQUARE,10,NeighborSpace,http://bcochicago.org/gardening,,,,FALSE,FALSE,TRUE,,FALSE,,,Compost System  Seating Area,On site water source,Community Garden  Ornamental / Beautification,,,
Ashlandia,1607 W Hollywood Ave,TRUE,Chicago IL,1607 W Hollywood Ave Chicago IL,41.9849907,-87.6702093,"[41.9849907,-87.6702093]",40,EDGEWATER,10,,www.petersongarden.org,,https://www.facebook.com/PetersonGardenProject?ref=br_tf,,TRUE,TRUE,TRUE,,FALSE,Peterson Garden Project,Cloche,Shed / Storage box,Hose connected to private property,Community Garden  Food Donation,,Unclear,
Bowmanville Gateway Garden,5346 N Ravenswood Ave,TRUE,Chicago IL,5346 N Ravenswood Ave Chicago IL,41.979294,-87.674911,"[41.979294,-87.674911]",40,LINCOLN SQUARE,10,NeighborSpace,http://bcochicago.org/gardening,,,,FALSE,FALSE,TRUE,,FALSE,,,Compost System  Seating Area  Shed / Storage box  Gazebo,On site water source,Community Garden,,Allotment  Collective,
Land on Lincoln,5900 N Lincoln Ave,TRUE,Chicago IL,5900 N Lincoln Ave Chicago IL,41.9882469,-87.7043834,"[41.9882469,-87.7043834]",40,WEST RIDGE,10,,www.petersongarden.org,,,,TRUE,TRUE,TRUE,,FALSE,Peterson Garden Project,,Seating Area  Performance Area  Shed / Storage box,City Fire Hydrant,Community Garden  Food Donation  Ornamental / Beautification,,Allotment  Collective,
Ruby Garden,1552 W Schreiber Ave,TRUE,Chicago IL,1552 W Schreiber Ave Chicago IL,41.9989753,-87.6701723,"[41.9989753,-87.6701722999999]",40,ROGERS PARK,10,Chicago Park District,http://www.therubygarden.com/,,https://www.facebook.com/therubygarden?ref=br_tf,,TRUE,FALSE,TRUE,,FALSE,The Marjorie Kovler Center,Cold Frame,Compost System  Seating Area  Shed / Storage box,On site water source,Community Garden  Food Donation  Ornamental / Beautification  Demo / Training / Program,,Allotment  Collective,
Senior Garden Plots,1783 W Peterson Ave,TRUE,Chicago IL,1783 W Peterson Ave Chicago IL,41.9907194,-87.6748061,"[41.9907194,-87.6748061]",40,LINCOLN SQUARE,10,,,,,,FALSE,FALSE,TRUE,,FALSE,,,Seating Area  Shed / Storage box  Covered Area,Rain collection system ( rain barrels  cisterns),Community Garden  (Assisted) Housing,,Allotment  Collective,
St. Scholastica,7494 N Ridge Ave,TRUE,Chicago IL,7494 N Ridge Ave Chicago IL,41.9979639,-87.6768341,"[41.9979638999999,-87.6768341]",40,WEST RIDGE,10,,,,,,TRUE,FALSE,TRUE,,FALSE,,,Compost System  Seating Area  Shed / Storage box  Artwork / Sculptures,On site water source,Community Garden  Congregation Garden,,Allotment,
Amundsen High School (Roald),5110 N Damen Ave,TRUE,Chicago IL,5110 N Damen Ave Chicago IL,41.9750696,-87.6800719,"[41.9750696,-87.6800719]",40,LINCOLN SQUARE,12,Chicago Public Schools,,,,,,,FALSE,FALSE,FALSE,,,,,School Garden  Ornamental / Beautification  Habitat / Conservation / Prairie,FALSE,Unclear,
Budlong Elementary School (Lyman A.),2701 W Foster,TRUE,Chicago IL,2701 W Foster Chicago IL,41.975251,-87.6968584,"[41.975251,-87.6968584]",40,LINCOLN SQUARE,12,Chicago Public Schools,,,,The Kitchen Community,TRUE,TRUE,TRUE,FALSE,FALSE,,,,,School Garden  Ornamental / Beautification  Habitat / Conservation / Prairie,FALSE,,
Chappell Elementary School Garden (Eliza),5145 N Leavitt St,TRUE,Chicago IL,5145 N Leavitt St Chicago IL,41.9754109,-87.6827942,"[41.9754109,-87.6827941999999]",40,LINCOLN SQUARE,12,,,,,,,,FALSE,FALSE,FALSE,,,,,School Garden,FALSE,,
Clinton Elementary School,6110 N Fairfield Chicago IL,FALSE,,6110 N Fairfield Chicago IL,41.9928287,-87.6985527,"[41.9928287,-87.6985527]",40,WEST RIDGE,10,Chicago Public Schools,,,,The Kitchen Community,,,TRUE,FALSE,FALSE,,,,,School Garden,FALSE,,
Mather High School Community Garden (Stephen T.),5835 N Lincoln Ave,TRUE,Chicago IL,5835 N Lincoln Ave Chicago IL,41.9882554,-87.7007698,"[41.9882554,-87.7007697999999]",40,WEST RIDGE,10,,,,,,,,FALSE,FALSE,FALSE,,,,,School Garden,TRUE,,
Northside College Preparatory School,5501 N Kedzie Ave,TRUE,Chicago IL,5501 N Kedzie Ave Chicago IL,41.9811841,-87.7078758,"[41.9811841,-87.7078758]",40,NORTH PARK,12,,,,,,,,TRUE,FALSE,FALSE,,,,On site water source,School Garden,FALSE,,
Arthur Avenue Neighbors Tower Garden,6464 N. Clark  Chicago  IL  60626,FALSE,,6464 N. Clark  Chicago  IL  60626,41.9995512,-87.6718673,"[41.9995512,-87.6718673]",40,ROGERS PARK,10,NeighborSpace,,,,,,,,FALSE,FALSE,,,,,Ornamental / Beautification,,,
Sprouts Garden at St. Matthias School,4910 N Claremont Ave  Chicago  IL 60625  USA,FALSE,,4910 N Claremont Ave  Chicago  IL 60625  USA,41.9708564,-87.6881197,"[41.9708564,-87.6881197]",40,LINCOLN SQUARE,12,Private,http://www.stmatthiasschool.org/parent-center/sprouts-garden-brick-pavers/,SMSsproutsgarden@gmail.com,,,TRUE,FALSE,TRUE,FALSE,FALSE,,,Play Area  Seating Area  Teaching Area,Hose connected to private property,School Garden,FALSE,Collective,
,6317 N Paulina St  Chicago  IL 60660  USA,FALSE,,6317 N Paulina St  Chicago  IL 60660  USA,41.9962062,-87.6716813,"[41.9962062,-87.6716813]",40,EDGEWATER,10,Private,,312.515.1545,,,TRUE,TRUE,TRUE,TRUE,FALSE,,,Compost System,Rain collection system ( rain barrels  cisterns),Urban Farm  Orchard  Rooftop  Single-tender Garden,FALSE,,
,2800 N Lake Shore Dr,TRUE,Chicago IL,2800 N Lake Shore Dr Chicago IL,41.933219,-87.6371314,"[41.933219,-87.6371314]",44,LAKE VIEW,10,Chicago Park District,go.illinois.edu/chicagomg,,,,TRUE,FALSE,TRUE,TRUE,FALSE,Cook County Chicago Master Gardeners  University of Illinois Extension Master Gardener,,,On site water source,Community Garden,TRUE,,
Lakeview Community Garden at Fletcher,935 W. Fletcher St. Chicago  IL 60657,FALSE,,935 W. Fletcher St. Chicago  IL 60657,41.9387161,-87.653012,"[41.9387161,-87.6530119999999]",44,LAKE VIEW,10,,https://www.facebook.com/LakeviewCommunityGardenChicago/,,,,TRUE,TRUE,TRUE,FALSE,FALSE,,,,,Community Garden,TRUE,Allotment,
Agassiz Elementary School,2851 N Seminary Ave,TRUE,Chicago IL,2851 N Seminary Ave Chicago IL,41.9339791,-87.6557259,"[41.9339790999999,-87.6557259]",44,LAKE VIEW,10,,,,,,,,FALSE,FALSE,FALSE,,,,,,FALSE,Unclear,
Blaine Elementary School (James G.),1420 W Grace Chicago IL,FALSE,,1420 W Grace Chicago IL,41.9509697,-87.6655493,"[41.9509697,-87.6655493]",44,LAKE VIEW,10,,,,,,TRUE,FALSE,FALSE,FALSE,FALSE,PTA,,Seating Area,Irrigation System  On site water source,Habitat / Conservation / Prairie  School Garden  Ornamental / Beautification,FALSE,,
Hawthorne Elementary Scholastic Academy,3319 N Clifton Ave Chicago IL,FALSE,,3319 N Clifton Ave Chicago IL,41.9422574,-87.6575746,"[41.9422574,-87.6575745999999]",44,LAKE VIEW,10,,,,,,,,FALSE,FALSE,FALSE,,,,,School Garden  Ornamental / Beautification,FALSE,,
Inter-American Magnet School,851 W Waveland Ave,TRUE,Chicago IL,851 W Waveland Ave Chicago IL,41.9487759,-87.6513353,"[41.9487759,-87.6513353]",44,LAKE VIEW,10,,,,,,,,TRUE,FALSE,FALSE,,,,,School Garden  Ornamental / Beautification  Habitat / Conservation / Prairie,FALSE,,
Nettlehorst Elementary School (Louis),3250 N. Broadway,TRUE,Chicago IL,3250 N. Broadway Chicago IL,41.9415442,-87.6447377,"[41.9415442,-87.6447377]",44,LAKE VIEW,10,,,,,,,,FALSE,FALSE,FALSE,Oppenheimer Family Foundation  Chicago Foundation for Education  the Chicago Conservation Corps. and the Nettelhorst Elementary School.,,,,School Garden  Ornamental / Beautification,FALSE,,
Burling Park,2931 N Burling St  Chicago  IL 60657  USA,FALSE,,2931 N Burling St  Chicago  IL 60657  USA,41.9354499,-87.6478813,"[41.9354498999999,-87.6478813]",44,LAKE VIEW,10,NeighborSpace,,burlingpark@yahoo.com.,https://www.facebook.com/pages/Burling-Park-of-Lake-View/334146826628425?fref=ts,NeighborSpace,TRUE,FALSE,FALSE,FALSE,FALSE,,,Play Area  Play Area  Play Area  Seating Area  Seating Area  Shed / Storage box,On site water source,Streetscape / Parkway,FALSE,,
Space Park,817 W Roscoe St  Chicago  IL 60657  USA,FALSE,,817 W Roscoe St  Chicago  IL 60657  USA,41.943352,-87.6502189,"[41.943352,-87.6502189]",44,LAKE VIEW,10,NeighborSpace,http://neighbor-space.org/2012/06/23/space-park/,Jim Ludwig  312-391-3355,,NeighborSpace,TRUE,FALSE,FALSE,FALSE,FALSE,Nothalsted Business Alliance,,Seating Area  Tables to eat,Irrigation,Community Garden  Ornamental / Beautification,TRUE,,
Haines Elementary School Gardens (John Charles),247 West 23rd Pl,TRUE,Chicago IL,247 West 23rd Pl Chicago IL,41.8496354,-87.6337159,"[41.8496354,-87.6337159]",25,CHICAGO,2,Chicago Public Schools,,,,,FALSE,FALSE,FALSE,FALSE,FALSE,,,,,School Garden  School Garden  Ornamental / Beautification,FALSE,,
Eco Rooftop Garden,2042 W 21st St,TRUE,Chicago IL,2042 W 21st St Chicago IL,41.8541763,-87.6776309,"[41.8541763,-87.6776309]",25,CHICAGO,7,,http://www.ecogardens.com/,,,,,,TRUE,FALSE,FALSE,,,,,Urban Farm  Rooftop,FALSE,,
Roosevelt Square Farm,Washburne & Loomis,TRUE,Chicago IL,Washburne & Loomis Chicago IL,41.866081,-87.6615487,"[41.866081,-87.6615487]",25,NEAR WEST SIDE,2,,http://www.growingpower.org/chicago_projects.htm,,,Growing Power,,,TRUE,FALSE,FALSE,,,,,Urban Farm,FALSE,,
El Jardin de Mariposas,1835 S Carpenter St,TRUE,Chicago IL,1835 S Carpenter St Chicago IL,41.856945,-87.652885,"[41.856945,-87.652885]",25,CHICAGO,7,NeighborSpace,http://neighbor-space.org/2012/05/23/el-jardin-de-las-mariposas-2/,,,,TRUE,FALSE,TRUE,,FALSE,,,Seating Area  Performance Area  Teaching Area  Covered Area,On site water source,Community Garden  Ornamental / Beautification,,,
Garden of Wonders,1810 S Racine Ave,TRUE,Chicago IL,1810 S Racine Ave Chicago IL,41.8575503,-87.6567596,"[41.8575503,-87.6567596]",25,CHICAGO,7,,,pilsengardenofwonders@gmail.com  (773) 980-9178,https://www.facebook.com/TheGardenOnRacine,,TRUE,TRUE,TRUE,FALSE,FALSE,,Cold Frame  Cloche,Compost System  Grill / Cooking Station  Seating Area  Covered Area,Rain collection system ( rain barrels  cisterns),Community Garden  Ornamental / Beautification,TRUE,Unclear,
Maxwell Street Community Garden,1314 S Blue Island Ave,TRUE,Chicago IL,1314 S Blue Island Ave Chicago IL,41.8647886,-87.6556995,"[41.8647886,-87.6556995]",25,NEAR WEST SIDE,2,,,,https://www.facebook.com/MaxwellStreetCommunityGarden,,TRUE,FALSE,TRUE,,FALSE,,,Compost System  Seating Area  Shed / Storage box  Artwork / Sculptures  Covered Area,Hose connected to private property,Community Garden,,Allotment  Collective,
New Horizons Community Garden,1750 W 18th Pl,TRUE,Chicago IL,1750 W 18th Pl Chicago IL,41.8569294,-87.6708883,"[41.8569294,-87.6708883]",25,CHICAGO,7,,,,,,TRUE,TRUE,TRUE,,FALSE,,,,No apparent water source,Community Garden,,Allotment  Collective,
La Huerta Roots and Rays,1513 W Cullerton St,TRUE,Chicago IL,1513 W Cullerton St Chicago IL,41.8548771,-87.6640312,"[41.8548771,-87.6640312]",25,CHICAGO,7,NeighborSpace,raizesyrayos.wordpress.com,Sam Kohn skohn9@gmail.com,https://www.facebook.com/groups/342074210953/,NeighborSpace,FALSE,FALSE,TRUE,,FALSE,,Cold Frame,Compost System  Grill / Cooking Station  Seating Area  Play Area  Shed / Storage box,City Fire Hydrant  Rain collection system ( rain barrels  cisterns)  Hose connected to private property,Community Garden  Food Donation  Ornamental / Beautification  Habitat / Conservation / Prairie,,Unclear,
,920 W 19th Pl,TRUE,Chicago IL,920 W 19th Pl Chicago IL,41.856192,-87.649354,"[41.856192,-87.649354]",25,CHICAGO,7,,,,,,FALSE,FALSE,TRUE,,FALSE,,,,No apparent water source,Community Garden,,Allotment  Collective,
Xochiquetzal Peace Garden (Whittier Elementary School),1903 W 23rd St,TRUE,Chicago IL,1903 W 23rd St Chicago IL,41.8501753,-87.6736719,"[41.8501753,-87.6736719]",25,CHICAGO,7,NeighborSpace,http://neighbor-space.org/2011/05/20/xochiquetzal-peace-garden/,,https://www.facebook.com/xochiquetzalpeacegarden?fref=ts,,TRUE,TRUE,TRUE,,FALSE,Whittier Elementary School,,Compost System  Seating Area  Shed / Storage box  Handicap accessible bed  Artwork / Sculptures  Water Management  Teaching Area  Educational Signage  Covered Area,On site water source  Rain collection system ( rain barrels  cisterns),Community Garden  School Garden  Ornamental / Beautification,,Allotment  Collective,
Cooper Elementary Dual Language Academy (Peter),1624 W 19th St,TRUE,Chicago IL,1624 W 19th St Chicago IL,41.8562181,-87.6672669,"[41.8562181,-87.6672669]",25,CHICAGO,7,,,,,,,,FALSE,FALSE,FALSE,,,,,School Garden,FALSE,Collective,
Finkl Elementary Academy Garden (William F.),2332 S Western Ave,TRUE,Chicago IL,2332 S Western Ave Chicago IL,41.849557,-87.6869563,"[41.849557,-87.6869562999999]",25,CHICAGO,7,,,,,,,,FALSE,FALSE,FALSE,,,,,School Garden  Habitat / Conservation / Prairie,FALSE,,
Juarez High School (Benito),1450-1510 W Cermak Rd,TRUE,Chicago IL,1450-1510 W Cermak Rd Chicago IL,41.8525773,-87.6642827,"[41.8525773,-87.6642827]",25,CHICAGO,7,Chicago Public Schools,,,,The Kitchen Community,FALSE,FALSE,TRUE,TRUE,FALSE,,,Shed / Storage box  Artwork / Sculptures  Compost System  Seating Area  Teaching Area,Irrigation System  On site water source,School Garden  Ornamental / Beautification  Habitat / Conservation / Prairie,FALSE,,
Smyth Elementary School (John M.),1059 W 13th St,TRUE,Chicago IL,1059 W 13th St Chicago IL,41.8652732,-87.653411,"[41.8652732,-87.6534109999999]",25,NEAR WEST SIDE,2,,,,,,,,FALSE,FALSE,FALSE,,,,,School Garden,FALSE,,
Orozco Fine Arts & Sciences Elementary School,1940 W 18th St,TRUE,Chicago IL,1940 W 18th St Chicago IL,41.8579735,-87.675151,"[41.8579735,-87.675151]",25,CHICAGO,7,,,,,,,,FALSE,FALSE,FALSE,,,,,School Garden,FALSE,,
Perez  Jr. Elementary School Garden (Manuel),1241 W 19th St,TRUE,Chicago IL,1241 W 19th St Chicago IL,41.8556781,-87.6579588,"[41.8556781,-87.6579588]",25,CHICAGO,7,,,,,,,,FALSE,FALSE,FALSE,,,,,School Garden,TRUE,,
Pickard Elementary School (Josiah),2301 W 21st St Chicago IL,FALSE,,2301 W 21st St Chicago IL,41.853645,-87.683437,"[41.853645,-87.683437]",25,CHICAGO,7,,,,,,,,FALSE,FALSE,FALSE,,,,,,FALSE,,
Ruiz Elementary School (Irma C.),2410 S Leavitt St,TRUE,Chicago IL,2410 S Leavitt St Chicago IL,41.8477733,-87.6813811,"[41.8477733,-87.6813811]",25,CHICAGO,7,Chicago Public Schools,,,,The Kitchen Community,TRUE,FALSE,TRUE,TRUE,FALSE,,,Artwork / Sculptures  Compost System  Play Area  Seating Area  Teaching Area,Irrigation System  On site water source,School Garden  Ornamental / Beautification  Habitat / Conservation / Prairie,FALSE,,
Windy City Harvest  Arturo Velasquez Institute,2800 S Western Ave,TRUE,Chicago IL,2800 S Western Ave Chicago IL,41.8410516,-87.6863215,"[41.8410516,-87.6863214999999]",25,CHICAGO,7,City of Chicago,https://www.chicagobotanic.org/windycityharvest/,,,Chicago Botanic Garden,TRUE,TRUE,TRUE,TRUE,FALSE,City Colleges of Chicago,Cold Tunnel  Greenhouse  Hoop house,,On site water source,Pantry Garden  School Garden  Urban Farm  Habitat / Conservation / Prairie  Demo / Training / Program  Urban Agriculture Organization,FALSE,,
El Paseo Community Garden,944 W 21st St  Chicago  IL 60608  USA,FALSE,,944 W 21st St  Chicago  IL 60608  USA,41.8544044,-87.6498455,"[41.8544044,-87.6498455]",25,CHICAGO,7,NeighborSpace,https://elpaseogarden.org/,elpaseo.communitygarden@neighbor-space.org,https://www.facebook.com/pages/El-Paseo-Community-Garden/417093588426680,NeighborSpace,TRUE,FALSE,TRUE,TRUE,FALSE,,Hoop house,Handicap accessible bed  Shed / Storage box  Seating Area  Compost System,On site water source,Community Garden  (Assisted) Housing  Ornamental / Beautification  Habitat / Conservation / Prairie,TRUE,,
Windy City Greens,1200 W Cermak Rd  Chicago  IL 60608  USA,FALSE,,1200 W Cermak Rd  Chicago  IL 60608  USA,41.8537887,-87.6567268,"[41.8537887,-87.6567268]",25,CHICAGO,7,Private,windycitygreens.com,info@windycitygreens.com,https://www.facebook.com/windycitygreens,,FALSE,TRUE,TRUE,FALSE,FALSE,,Greenhouse,,On site water source,Urban Farm,FALSE,Collective  Allotment,
Daniel Hudson Burnham Apartments Garden,1930 W Loyola Ave,TRUE,Chicago IL,1930 W Loyola Ave Chicago IL,42.0007363,-87.6792985,"[42.0007363,-87.6792985]",50,WEST RIDGE,13,,,,,,TRUE,FALSE,TRUE,,FALSE,,,,No apparent water source,Community Garden  (Assisted) Housing,,,
The Gan Project,3003 W Touhy Ave,TRUE,Chicago IL,3003 W Touhy Ave Chicago IL,42.0113292,-87.7053357,"[42.0113292,-87.7053356999999]",50,WEST RIDGE,13,,http://dev2.theganproject.org/,,https://www.facebook.com/pages/The-Gan-Project/108898809150347?ref=br_tf,,FALSE,FALSE,TRUE,,FALSE,The Gan Project,Cold Frame,Compost System  Seating Area  Shed / Storage box  Handicap accessible bed  Water Feature (ponds  fountain)  Information Kiosk,Rain collection system ( rain barrels  cisterns)  Hose connected to private property,Community Garden  Pantry Garden  Demo / Training / Program,,Allotment,
Armstrong School Garden (George),2110 W Greenleaf Ave,TRUE,Chicago IL,2110 W Greenleaf Ave Chicago IL,42.0103833,-87.6854095,"[42.0103833,-87.6854094999999]",50,WEST RIDGE,13,Chicago Public Schools,,,,The Kitchen Community,FALSE,FALSE,TRUE,FALSE,FALSE,,,,,School Garden  Ornamental / Beautification,FALSE,Collective,
Boone Elementary School (Daniel),6710 N Washtenaw Ave,TRUE,Chicago IL,6710 N Washtenaw Ave Chicago IL,42.0040791,-87.6979897,"[42.0040791,-87.6979897]",50,WEST RIDGE,13,,,,,,,,TRUE,FALSE,FALSE,,,,,School Garden  Ornamental / Beautification,FALSE,,
Decatur Classical Garden Club,7030 N Sacramento  Chicago,FALSE,,7030 N Sacramento  Chicago,42.0099515,-87.7054011,"[42.0099515,-87.7054011]",50,WEST RIDGE,13,,,,,,,,FALSE,FALSE,FALSE,,,,,School Garden  Ornamental / Beautification,FALSE,,
Rogers Elementary School (Philip),7345 N Washtenaw Ave,TRUE,Chicago IL,7345 N Washtenaw Ave Chicago IL,42.0153881,-87.6963119,"[42.0153881,-87.6963119]",50,WEST RIDGE,13,Chicago Public Schools,,,,The Kitchen Community,FALSE,FALSE,TRUE,FALSE,FALSE,,,,,School Garden  Ornamental / Beautification  Habitat / Conservation / Prairie,FALSE,,
Stone Elementary Scholastic Academy Garden (Leander),6239 N Leavitt St,TRUE,Chicago IL,6239 N Leavitt St Chicago IL,41.9954315,-87.6843911,"[41.9954315,-87.6843911]",50,WEST RIDGE,10,,,,,,,,FALSE,FALSE,FALSE,,,,,School Garden,FALSE,,
West Ridge,6700 N Whipple St,TRUE,Chicago IL,6700 N Whipple St Chicago IL,42.0028299,-87.7061001,"[42.0028299,-87.7061001]",50,WEST RIDGE,13,,,,,,,,FALSE,FALSE,FALSE,,,,,,FALSE,,
4400 Leamington Garden,4500 S Laramie Ave,TRUE,Chicago IL,4500 S Laramie Ave Chicago IL,41.8110551,-87.7530056,"[41.8110551,-87.7530056]",22,GARFIELD RIDGE,16,,,,,,TRUE,FALSE,TRUE,,FALSE,,,Fire Pit  Seating Area,Hose connected to private property,Community Garden  Community Farm,,,
Lawndale Triangle Garden,4226 W Ogden Ave  Chicago  IL 60623  USA,FALSE,,4226 W Ogden Ave  Chicago  IL 60623  USA,41.8492525,-87.7305629,"[41.8492525,-87.7305629]",22,NORTH LAWNDALE,2,NeighborSpace,http://neighbor-space.org/gardens/,,,,TRUE,,,,,,,,,,TRUE,Allotment,
6062Trees:Sembrando Bajo el Sol,2612 S Trumbull Ave,TRUE,Chicago IL,2612 S Trumbull Ave Chicago IL,41.843984,-87.711473,"[41.843984,-87.711473]",22,CHICAGO,7,NeighborSpace,http://enlacechicago.org/programs-page/community-economic-development/placemaking/greenspace-and-pocket-parks/6062trees-sembrando-bajo-el-sol-26th-and-trumbull/,mherrera@enlacechicago.org,http://enlacechicago.org/,,TRUE,TRUE,TRUE,TRUE,FALSE,Enlace,Cold Tunnel  Cloche,Compost System  Seating Area  Play Area  Shed / Storage box  Handicap accessible bed  Artwork / Sculptures  Water Management  Educational Signage  Covered Area  Information Kiosk,On site water source,Community Garden  Ornamental / Beautification  Habitat / Conservation / Prairie,TRUE,,
Cosecha Verde,2756 S Harding Ave,TRUE,Chicago IL,2756 S Harding Ave Chicago IL,41.8407283,-87.7235171,"[41.8407282999999,-87.7235171]",22,CHICAGO,7,Private,http://enlacechicago.org/programs-page/community-economic-development/placemaking/greenspace-and-pocket-parks/cosecha-verdegreen-harvest-28th-and-harding/,,http://enlacechicago.org/,,TRUE,TRUE,TRUE,TRUE,FALSE,Enlace,,Compost System  Grill / Cooking Station  Shed / Storage box,Hose connected to private property,Community Garden  Orchard,,Collective,
Gary Elementary School Garden,3740 W 31st St,TRUE,Chicago IL,3740 W 31st St Chicago IL,41.8379054,-87.7187846,"[41.8379054,-87.7187845999999]",22,CHICAGO,7,,http://lvejo.org/,,https://www.facebook.com/pages/Little-Village-Environmental-Justice-Organization-LVEJO/92669819450,,TRUE,TRUE,TRUE,,FALSE,LVEJO,Cold Frame  Cold Tunnel,Seating Area  Shed / Storage box,Hose connected to private property,Community Garden  Food Donation  School Garden,,Collective,
La Villita Nature Play Garden,4231 W. 25th Place  Chicago  IL 60623,FALSE,,4231 W. 25th Place  Chicago  IL 60623,41.844825,-87.73077,"[41.844825,-87.7307699999999]",22,CHICAGO,7,NeighborSpace,,,https://www.facebook.com/La-Villita-Nature-Play-Garden-1819962374975158/,,TRUE,FALSE,FALSE,FALSE,FALSE,,,,On site water source,Community Garden  School Garden,TRUE,Collective,
Jardin de la Amistad,4280 W 27th St,TRUE,Chicago IL,4280 W 27th St Chicago IL,41.8424709,-87.7314617,"[41.8424709,-87.7314617]",22,CHICAGO,7,,http://enlacechicago.org/programs-page/community-economic-development/placemaking/greenspace-and-pocket-parks/friendship-gardenjardin-de-amistad-27th-and-kildare/,,http://enlacechicago.org/,,TRUE,TRUE,TRUE,,FALSE,Enlace,Hoop house,Compost System  Seating Area  Shed / Storage box,Rain collection system ( rain barrels  cisterns),Community Garden  Ornamental / Beautification,,Collective,
Mr. Keeler's Pumpkin Eater's,4168 W 25th St,TRUE,Chicago IL,4168 W 25th St Chicago IL,41.8462289,-87.7288944,"[41.8462289,-87.7288944]",22,CHICAGO,7,,http://enlacechicago.org/programs-page/community-economic-development/placemaking/greenspace-and-pocket-parks/mr-keelers-pumpkin-eaters-25th-and-keeler/,,http://enlacechicago.org/,,TRUE,FALSE,TRUE,TRUE,FALSE,Enlace,,Information Kiosk  Seating Area,On site water source,Community Garden  Habitat / Conservation / Prairie,TRUE,Collective,
UPrising Garden,3742 W 28th St,TRUE,Chicago IL,3742 W 28th St Chicago IL,41.8408873,-87.7185751,"[41.8408873,-87.7185751]",22,CHICAGO,7,,http://www.universidadpopular.us/,,https://www.facebook.com/UPLatinCenter,,TRUE,FALSE,TRUE,,FALSE,CLOCC,,Compost System  Grill / Cooking Station  Seating Area,Hose connected to private property,Community Garden  Ornamental / Beautification,,Collective,
Corkery Elementary School Butterfly Garden (Daniel J.),2510 S Kildare,TRUE,Chicago IL,2510 S Kildare Chicago IL,41.8456092,-87.7322715,"[41.8456092,-87.7322715]",22,CHICAGO,7,,,,,,,,FALSE,FALSE,FALSE,,,,,School Garden  Ornamental / Beautification,FALSE,Collective,
Castellanos Elementary School (Rosario),2524 S Central Park Ave  Chicago  IL,FALSE,,2524 S Central Park Ave  Chicago  IL,41.8456046,-87.7151907,"[41.8456046,-87.7151907]",22,CHICAGO,7,,,,,,,,FALSE,FALSE,FALSE,,,,,,FALSE,,
Dominguez Elementary School (Josefa Ortiz De),3000 S Lawndale Ave,TRUE,Chicago IL,3000 S Lawndale Ave Chicago IL,41.8382787,-87.7176238,"[41.8382787,-87.7176238]",22,CHICAGO,7,,,,,,,,FALSE,FALSE,FALSE,,,,,School Garden  Ornamental / Beautification,FALSE,,
Little Village Elementary Academy,2620 S Lawndale Ave,TRUE,Chicago IL,2620 S Lawndale Ave Chicago IL,41.8429553,-87.7175408,"[41.8429553,-87.7175408]",22,CHICAGO,7,,,,,,,,TRUE,FALSE,FALSE,,,,,School Garden,FALSE,,
Little Village High School,3120 S Kostner Ave Chicago IL,FALSE,,3120 S Kostner Ave Chicago IL,41.8358649,-87.7356218,"[41.8358649,-87.7356217999999]",22,CHICAGO,7,,,,,,,,FALSE,FALSE,FALSE,,,,,School Garden  Ornamental / Beautification,FALSE,,
Madero Middle School,3202 W 28th St,TRUE,Chicago IL,3202 W 28th St Chicago IL,41.8409871,-87.7052921,"[41.8409871,-87.7052921]",22,CHICAGO,7,Chicago Public Schools,,,,The Kitchen Community,TRUE,FALSE,TRUE,FALSE,FALSE,,,Artwork / Sculptures  Seating Area  Teaching Area,Irrigation System  On site water source,School Garden,FALSE,,
