growing_site_name,address,has_chicago,add_chicago,full_address,Latitude,Longitude,location,ward,community,district_n,ownership,growing_site_website,public_contact_info,facebook,evidence_of_support_organizations,is_growing_site_fenced,is_growing_site_locked,food_producing,compost_system,is_growing_site_dormant,other_support_organization,season_extension_techniques,structures_and_features,water,choose_growing_site_types,community_garden,if_it_s_a_community_garden_is_it_collective_or_allotment,neighborhood
Woodson South (University of Chicago Charter Middle School),4444 S Evans Ave,TRUE,Chicago IL,4444 S Evans Ave Chicago IL,41.81408,-87.6086863,"[41.81408,-87.6086863]",3,CHICAGO,3,,,,,The Kitchen Community,TRUE,FALSE,TRUE,FALSE,FALSE,,,Artwork / Sculptures  Seating Area  Teaching Area,On site water source  Irrigation System,School Garden,FALSE,,
Eden Place Nature Center,4417 S Stewart Ave,TRUE,Chicago IL,4417 S Stewart Ave Chicago IL,41.8145548,-87.6354498,"[41.8145548,-87.6354498]",3,CHICAGO,2,,http://www.edenplacenaturecenter.org/,,,,,,TRUE,FALSE,FALSE,,,,,Urban Farm,FALSE,,
Legends Community Garden,4450 South Dearborn,TRUE,Chicago IL,4450 South Dearborn Chicago IL,41.8135297,-87.6276027,"[41.8135297,-87.6276027]",3,CHICAGO,2,,https://www.chicagobotanic.org/windycityharvest/,,,Chicago Botanic Garden,TRUE,TRUE,TRUE,FALSE,FALSE,Brinshore Michaels,Hoop house,,,(Assisted) Housing  Urban Farm,FALSE,Allotment,
Windy City Harvest Legends Farm,4451 South Federal,TRUE,Chicago IL,4451 South Federal Chicago IL,41.8133388,-87.6281419,"[41.8133388,-87.6281419]",3,CHICAGO,2,Chicago Housing Authority,https://www.chicagobotanic.org/windycityharvest/,,,Chicago Botanic Garden,TRUE,TRUE,TRUE,FALSE,FALSE,Brinshore Michaels,,,,Urban Farm  Demo / Training / Program,TRUE,,
Urban Aggies,4448 S State St,TRUE,Chicago IL,4448 S State St Chicago IL,41.8132492,-87.6266976,"[41.8132492,-87.6266976]",3,CHICAGO,2,,http://urbanaggies.com,,https://www.facebook.com/UrbanAggies/info,,,TRUE,TRUE,FALSE,FALSE,Brinshore Michaels,,,,Urban Farm,FALSE,,
Anderson Park Harvest Garden,3748 S Prairie Ave  Chicago  IL 60653  USA,FALSE,,3748 S Prairie Ave  Chicago  IL 60653  USA,41.8259727,-87.6207205,"[41.8259727,-87.6207204999999]",3,CHICAGO,3,Chicago Park District,,,,,TRUE,FALSE,TRUE,TRUE,FALSE,,,Teaching Area,On site water source,,FALSE,,
Ida B. Wells Preparatory Elementary School,249 E 37th St  Chicago  IL 60653  USA,FALSE,,249 E 37th St  Chicago  IL 60653  USA,41.8267379,-87.6199324,"[41.8267379,-87.6199324]",3,CHICAGO,3,,,,,The Kitchen Community,TRUE,FALSE,TRUE,FALSE,FALSE,,,Artwork / Sculptures  Covered Area  Handicap accessible bed  Seating Area  Teaching Area,On site water source  Irrigation System,School Garden,FALSE,,
Park No. 540 Community Garden,2401 S. Federal St.  Chicago  IL 60616,FALSE,,2401 S. Federal St.  Chicago  IL 60616,41.848703,-87.62873,"[41.848703,-87.62873]",3,NEAR SOUTH SIDE,2,Chicago Park District,,,https://www.facebook.com/Park-No-540-Community-Garden-138524426704198/,,FALSE,FALSE,TRUE,FALSE,,,,,On site water source,Community Garden,TRUE,Unclear,
Robeson High School Garden (Paul),6935 S Normal/6835 S Normal,TRUE,Chicago IL,6935 S Normal/6835 S Normal Chicago IL,41.7679777,-87.6369305,"[41.7679777,-87.6369304999999]",4,LOOP,3,,,,,,,,TRUE,FALSE,FALSE,,,,,School Garden  Ornamental / Beautification  Habitat / Conservation / Prairie,FALSE,,
Shoop Elementary Academy Garden (John D.),1460 W 112th Street (John D.),TRUE,Chicago IL,1460 W 112th Street (John D.) Chicago IL,41.6911508,-87.6590378,"[41.6911508,-87.6590378]",4,LOOP,3,,,,,,,,FALSE,FALSE,FALSE,,,,,School Garden,FALSE,,
Harold Washington Library Winter Garden,400 S State St  Chicago  IL 60605  USA,FALSE,,400 S State St  Chicago  IL 60605  USA,41.876515,-87.62824,"[41.876515,-87.6282399999999]",4,LOOP,3,Chicago Public Library,http://www.chipublib.org/private-event-rentals/,,,,TRUE,FALSE,FALSE,FALSE,FALSE,,,Artwork / Sculptures  Artwork / Sculptures  Artwork / Sculptures  Seating Area  Seating Area  Covered Area,On site water source  No apparent water source,,FALSE,,
St Paul and the Redeemer,4945 S Dorchester Ave,TRUE,Chicago IL,4945 S Dorchester Ave Chicago IL,41.8044433,-87.5914449,"[41.8044433,-87.5914449]",4,KENWOOD,3,,,,,,FALSE,FALSE,TRUE,,FALSE,,,Seating Area,Hose connected to private property,Community Garden  Pantry Garden  Congregation Garden,,Collective,
Lake Meadows Park,3117 S Rhodes Ave,TRUE,Chicago IL,3117 S Rhodes Ave Chicago IL,41.8379369,-87.6114358,"[41.8379369,-87.6114358]",4,CHICAGO,3,Chicago Park District,http://www.chicagoparkdistrict.com/facilities/community-gardens/,,,,,,FALSE,,FALSE,,,,,Community Garden,,,
Christ the Mediator Lutheran Church,3100 S Calumet Ave,TRUE,Chicago IL,3100 S Calumet Ave Chicago IL,41.8380454,-87.6179277,"[41.8380454,-87.6179277]",4,CHICAGO,3,,,,,,FALSE,FALSE,TRUE,,FALSE,,,Seating Area,Hose connected to private property,Community Garden  Congregation Garden,,Collective,
Common Threads World Garden,1330 E 50th St,TRUE,Chicago IL,1330 E 50th St Chicago IL,41.8049448,-87.5941814,"[41.8049448,-87.5941814]",4,KENWOOD,3,Chicago Park District,www.commonthreads.com,,,,TRUE,TRUE,TRUE,,FALSE,,,Compost System  Seating Area  Shed / Storage box,Rain collection system ( rain barrels  cisterns),Community Garden  Food Donation  Demo / Training / Program,,Collective,
Edible Treasures,1400 S Lake Shore Dr,TRUE,Chicago IL,1400 S Lake Shore Dr Chicago IL,41.8662166,-87.6169853,"[41.8662166,-87.6169853]",4,NEAR SOUTH SIDE,3,,http://fieldmuseum.org/explore/edible-treasures-garden,,,,FALSE,FALSE,TRUE,,FALSE,Field Museum,,Seating Area,Hose connected to private property,Community Garden  Ornamental / Beautification  Demo / Training / Program,,Collective,
KAM Isaiah Israel Congregation Gardens,1100 E Hyde Park Blvd,TRUE,Chicago IL,1100 E Hyde Park Blvd Chicago IL,41.8028883,-87.598619,"[41.8028883,-87.598619]",4,KENWOOD,3,Private,https://kamii.org/content/our-garden,,https://www.facebook.com/KAMIIGarden,,FALSE,FALSE,TRUE,TRUE,FALSE,KAM Isaiah Israel (Social Justice Committee),Cold Frame,Shed / Storage box,Hose connected to private property  Irrigation System,Congregation Garden  Urban Farm  Food Donation  Demo / Training / Program  Ornamental / Beautification  Urban Agriculture Organization,FALSE,Collective,
Redbrick Townhome Association,1216 E 48th St,TRUE,Chicago IL,1216 E 48th St Chicago IL,41.8079746,-87.5961435,"[41.8079746,-87.5961435]",4,KENWOOD,3,,,,,,FALSE,FALSE,TRUE,,FALSE,,,,Rain collection system ( rain barrels  cisterns),,,Allotment,
,629 E 33rd St,TRUE,Chicago IL,629 E 33rd St Chicago IL,41.8347432,-87.610365,"[41.8347432,-87.610365]",4,CHICAGO,3,,,,,,,,TRUE,,FALSE,,,Seating Area,Rain collection system ( rain barrels  cisterns)  Irrigation System,Community Farm,,,
Canter Leadershiop Academy,4959 S Blackstone Ave,TRUE,Chicago IL,4959 S Blackstone Ave Chicago IL,41.8045313,-87.5900101,"[41.8045313,-87.5900101]",4,KENWOOD,3,,,,,,,,FALSE,FALSE,FALSE,,,,,,FALSE,,
Pershing School,3200 S Calumet Ave,TRUE,Chicago IL,3200 S Calumet Ave Chicago IL,41.8360169,-87.6185579,"[41.8360169,-87.6185579]",4,CHICAGO,3,,,,,The Kitchen Community,FALSE,FALSE,TRUE,FALSE,FALSE,,,Artwork / Sculptures  Covered Area  Handicap accessible bed  Seating Area  Teaching Area,On site water source  Irrigation System,School Garden,FALSE,,
Dunbar Career Academy High School (Paul Laurence),3000 S King Dr Chicago IL,FALSE,,3000 S King Dr Chicago IL,41.84005,-87.6184116,"[41.84005,-87.6184116]",4,CHICAGO,3,Chicago Public Schools,,,,The Kitchen Community,TRUE,TRUE,TRUE,FALSE,FALSE,,,Covered Area  Artwork / Sculptures  Teaching Area  Seating Area,Irrigation System  On site water source,School Garden,FALSE,,
Jones College Prep High School (William),606 S State St,TRUE,Chicago IL,606 S State St Chicago IL,41.8743777,-87.627972,"[41.8743777,-87.627972]",4,LOOP,3,,,,,,FALSE,FALSE,FALSE,FALSE,FALSE,,,,,School Garden  School Garden  Ornamental / Beautification,FALSE,,
King High School (Dr. Martin Luther),4445 S Drexel Blvd Chicago IL,FALSE,,4445 S Drexel Blvd Chicago IL,41.8138914,-87.6027668,"[41.8138914,-87.6027668]",4,KENWOOD,3,,,,,,,,FALSE,FALSE,FALSE,,,,,,FALSE,,
NKO Charter School,1119 E 46th Street,TRUE,Chicago IL,1119 E 46th Street Chicago IL,41.8110793,-87.5986539,"[41.8110793,-87.5986539]",4,KENWOOD,3,,,,,,,,TRUE,FALSE,FALSE,,,,,School Garden  Ornamental / Beautification,FALSE,,
Reavis Math & Science Specialty ES (William C.),834 E 50th St,TRUE,Chicago IL,834 E 50th St Chicago IL,41.8043999,-87.6054312,"[41.8043999,-87.6054312]",4,KENWOOD,3,,,,,,,,TRUE,FALSE,FALSE,,,,,School Garden,FALSE,,
Shoesmith Elementary School (Beulah),1330 E. 50th Street,TRUE,Chicago IL,1330 E. 50th Street Chicago IL,41.8049448,-87.5941814,"[41.8049448,-87.5941814]",4,KENWOOD,3,,,,,,,,TRUE,FALSE,FALSE,,,,,School Garden  Ornamental / Beautification,FALSE,,
Windy City Harvest McCormick Place Rooftop Farm,2301 S. Lake Shore Drive,TRUE,Chicago IL,2301 S. Lake Shore Drive Chicago IL,41.8519358,-87.6116954,"[41.8519358,-87.6116954]",4,NEAR SOUTH SIDE,3,Private,https://www.chicagobotanic.org/windycityharvest/,,,Chicago Botanic Garden,TRUE,TRUE,TRUE,FALSE,FALSE,SAVOR Chicago,,,,Urban Farm  Ornamental / Beautification  Habitat / Conservation / Prairie  Rooftop  Demo / Training / Program  Restaurant / Catering Garden,FALSE,,
Washington Park Youth Farm (Windy City Harvest),555 E 51st St,TRUE,Chicago IL,555 E 51st St Chicago IL,41.8011643,-87.6123949,"[41.8011643,-87.6123949]",4,CHICAGO,3,Chicago Park District,http://www.chicagobotanic.org/greenyouthfarm/dyett/,,,Chicago Botanic Garden,TRUE,TRUE,TRUE,TRUE,FALSE,Chicago Park District,Hoop house,Compost System  Covered Area  Educational Signage,Hose connected to private property,Pantry Garden  Urban Farm  Ornamental / Beautification  Demo / Training / Program  Orchard  Urban Agriculture Organization,FALSE,,
Kenwood United Church of Christ Garden,4600 S Greenwood Ave  Chicago  IL 60653  USA,FALSE,,4600 S Greenwood Ave  Chicago  IL 60653  USA,41.811234,-87.5997775,"[41.811234,-87.5997775]",4,KENWOOD,3,Private,https://kamii.org/content/our-garden,,,,TRUE,TRUE,TRUE,,FALSE,KAM Isaiah Israel (Social Justice Committee),Cold Frame,,,Food Donation  Congregation Garden  Urban Farm  Ornamental / Beautification  Demo / Training / Program,FALSE,,
Northerly Island Park Harvest Garden,1521 S Linn White Dr  Chicago  IL 60605  USA,FALSE,,1521 S Linn White Dr  Chicago  IL 60605  USA,41.8603641,-87.6100907,"[41.8603641,-87.6100907]",4,NEAR SOUTH SIDE,3,Chicago Park District,,,,,FALSE,FALSE,TRUE,TRUE,FALSE,,,Teaching Area,On site water source,Demo / Training / Program,FALSE,,
Ferd Kramer Memorial Garden,61 W Polk St  Chicago  IL 60605  USA,FALSE,,61 W Polk St  Chicago  IL 60605  USA,41.8720566,-87.6297107,"[41.8720566,-87.6297106999999]",4,LOOP,3,NeighborSpace,http://neighbor-space.org/2012/06/23/ferd-kramer-memorial-garden/,Donna Hippensteel donnahip@sbcglobal.net,,,,,,,,,,,,,,,
OTIS Fresh Farm,2616 S Calumet Ave  Chicago  IL 60616  USA,FALSE,,2616 S Calumet Ave  Chicago  IL 60616  USA,41.8448653,-87.6191355,"[41.8448653,-87.6191355]",4,CHICAGO,3,Private,,otisfreshmarket@gmail.com,www.facebook.com/otisfreshmarket,,FALSE,FALSE,TRUE,TRUE,FALSE,,Greenhouse,Compost System  Grill / Cooking Station  Covered Area  Farm Stand,Rain collection system ( rain barrels  cisterns)  Irrigation System,Urban Agriculture Organization  Urban Farm  Demo / Training / Program  Restaurant / Catering Garden,FALSE,,
Ancona School Garden,4770 S. Dorchester,TRUE,Chicago IL,4770 S. Dorchester Chicago IL,41.8083812,-87.5922508,"[41.8083812,-87.5922508]",4,KENWOOD,3,Private,anconaschool.org,Chris Weber  773-746-5223  cweber@anconaschool.org,,,TRUE,TRUE,TRUE,TRUE,FALSE,Anacona School,Cold Tunnel  Greenhouse,Water Management  Shed / Storage box  Grill / Cooking Station  Fire Pit  Artwork / Scultptures  Water Feature (ponds  fountain)  Seating Area  Educational Signage,Hose connected to private property,School Garden,FALSE,,
E & J  Co-op,1101 N Leavitt St  Chicago  IL 60622  USA,FALSE,,1101 N Leavitt St  Chicago  IL 60622  USA,41.901423,-87.6817949,"[41.901423,-87.6817949]",2,WEST TOWN,2,Private,,,,,TRUE,,TRUE,TRUE,FALSE,,,Seating Area,Rain collection system ( rain barrels  cisterns)  On site water source,Streetscape / Parkway,,,
Columbus Elementary Community Garden (Christopher),1003 N. Leavitt Street,TRUE,Chicago IL,1003 N. Leavitt Street Chicago IL,41.8996546,-87.6814582,"[41.8996546,-87.6814582]",2,WEST TOWN,2,,,,,,,,FALSE,FALSE,FALSE,,,,,School Garden  Ornamental / Beautification,TRUE,,
Lozano Elementary School (Rodolpho),1501 N Greenview,TRUE,Chicago IL,1501 N Greenview Chicago IL,41.9091303,-87.664937,"[41.9091303,-87.664937]",2,WEST TOWN,12,,,,,,,,FALSE,FALSE,FALSE,,,,,School Garden  Ornamental / Beautification,FALSE,,
Ogden Elementary School (William B.),24 W Walton St Chicago IL,FALSE,,24 W Walton St Chicago IL,41.9002924,-87.6290504,"[41.9002924,-87.6290504]",2,NEAR NORTH SIDE,12,,,,,,,,FALSE,FALSE,FALSE,,,,,,FALSE,,
Rowe Elementary School,1424 N Cleaver St  Chicago  IL 60642,FALSE,,1424 N Cleaver St  Chicago  IL 60642,41.907862,-87.6645564,"[41.907862,-87.6645564]",2,WEST TOWN,12,Chicago Public Schools,http://www.roweelementaryschool.org/,,N,The Kitchen Community  Gardeneers,,,TRUE,FALSE,FALSE,,,,,Food Donation  School Garden,FALSE,,
Haugan Elementary School,4540 N Hamlin Ave,TRUE,Chicago IL,4540 N Hamlin Ave Chicago IL,41.9637127,-87.7238106,"[41.9637126999999,-87.7238106]",35,ALBANY PARK,8,Chicago Public Schools,,,,The Kitchen Community,TRUE,FALSE,TRUE,FALSE,FALSE,,,,,School Garden,FALSE,,
Henry Elementary School Garden (Patrick),4250 N St. Louis Ave,TRUE,Chicago IL,4250 N St. Louis Ave Chicago IL,41.9586714,-87.7159066,"[41.9586714,-87.7159066]",35,IRVING PARK,8,,,,,,,,FALSE,FALSE,FALSE,,,,,School Garden,FALSE,,
Kimball Medill Corner Farm,2318 N Kimball Ave,TRUE,Chicago IL,2318 N Kimball Ave Chicago IL,41.9235886,-87.7123657,"[41.9235886,-87.7123657]",35,LOGAN SQUARE,8,,http://www.cornerfarm.org/kimball-medill/,,,,FALSE,FALSE,TRUE,,FALSE,,,Compost System,Hose connected to private property,Community Garden  Pantry Garden,,Allotment  Collective,
Mindful Living,3323 N Drake Ave,TRUE,Chicago IL,3323 N Drake Ave Chicago IL,41.94188,-87.7160212,"[41.94188,-87.7160212]",35,AVONDALE,8,NeighborSpace,http://mindfullivingchicago.blogspot.com/,,,,FALSE,FALSE,TRUE,,FALSE,,Hoop house,Compost System  Seating Area  Shed / Storage box  Artwork / Sculptures,No apparent water source,Community Garden,,Collective,
Monticello Garden,2227 N Monticello Ave,TRUE,Chicago IL,2227 N Monticello Ave Chicago IL,41.9218246,-87.7176657,"[41.9218246,-87.7176657]",35,LOGAN SQUARE,8,NeighborSpace,http://monticellocommunitygarden.com/,,https://www.facebook.com/monticellogarden,,TRUE,FALSE,TRUE,,FALSE,,,Compost System  Seating Area  Shed / Storage box  Electricity Outlet  Information Kiosk,On site water source  Rain collection system ( rain barrels  cisterns)  Hose connected to private property,Community Garden  Ornamental / Beautification,,Collective,
Monroe Elementary School Garden (James),3651 W Schubert Ave Chicago IL,FALSE,,3651 W Schubert Ave Chicago IL,41.929614,-87.7188009,"[41.929614,-87.7188008999999]",35,LOGAN SQUARE,8,,,,,,,,FALSE,FALSE,FALSE,,,,,School Garden  Ornamental / Beautification,FALSE,,
Mozart Elementary School (Wolfgang A.),2200 N Hamlin Chicago IL,FALSE,,2200 N Hamlin Chicago IL,41.9213348,-87.7224165,"[41.9213348,-87.7224165]",35,LOGAN SQUARE,8,,,,,,,,FALSE,FALSE,FALSE,,,,,,FALSE,,
Paradise Garden on Drake,2214 N Drake Ave  Chicago  IL  60647,FALSE,,2214 N Drake Ave  Chicago  IL  60647,41.9216231,-87.7155179,"[41.9216231,-87.7155179]",35,LOGAN SQUARE,8,NeighborSpace,,,,,TRUE,TRUE,,FALSE,FALSE,,,,,,,Collective,
Murphy Elementary School Garden (John B.),3539 W Grace St,TRUE,Chicago IL,3539 W Grace St Chicago IL,41.9495638,-87.7171077,"[41.9495638,-87.7171077]",35,IRVING PARK,8,,,,,,,,FALSE,FALSE,FALSE,,,,,School Garden  Ornamental / Beautification,FALSE,,
Nixon Elementary School (William P.),2121 N Keeler Ave Chicago IL,FALSE,,2121 N Keeler Ave Chicago IL,41.9195512,-87.7310365,"[41.9195512,-87.7310365]",35,CHICAGO,8,,,,,,,,FALSE,FALSE,FALSE,,,,,,FALSE,,
Earl's Community Garden,8530 S Harvard Ave,TRUE,Chicago IL,8530 S Harvard Ave Chicago IL,41.7351253,-87.6331325,"[41.7351253,-87.6331325]",21,ROSELAND,4,,,,,,TRUE,TRUE,TRUE,,FALSE,,,,Hose connected to private property,Community Garden  Single-tender Garden,,Collective,
Calumet Career Academy,8131 S May,TRUE,Chicago IL,8131 S May Chicago IL,41.7458355,-87.6520244,"[41.7458355,-87.6520244]",21,AUBURN GRESHAM,3,,,,,,,,FALSE,FALSE,FALSE,,,,,School Garden,FALSE,,
Burlin's Garden,9236 S Loomis St,TRUE,Chicago IL,9236 S Loomis St Chicago IL,41.7256227,-87.6582208,"[41.7256227,-87.6582208]",21,CHICAGO,4,,,,,,FALSE,FALSE,TRUE,,FALSE,,,,Hose connected to private property,Community Garden  Single-tender Garden,,Collective,
Gaia Community Garden,8918 S Green St,TRUE,Chicago IL,8918 S Green St Chicago IL,41.7319032,-87.6451162,"[41.7319032,-87.6451161999999]",21,AUBURN GRESHAM,4,,http://www.gaia-movement.org/TextPage.asp?TxtID=390&SubMenuItemID=103&MenuItemID=47,,https://www.facebook.com/GaiaMovement,,TRUE,TRUE,TRUE,,FALSE,,,Compost System  Grill / Cooking Station  Seating Area  Shed / Storage box  Covered Area,Hose connected to private property,Demo / Training / Program,,Collective,
Mary Helen Community Garden,9763 S Racine Ave,TRUE,Chicago IL,9763 S Racine Ave Chicago IL,41.7164986,-87.6526609,"[41.7164986,-87.6526609]",21,CHICAGO,4,,www.griffinpropertymgnt.com,,https://www.facebook.com/pages/Mary-Helen-Community-Garden/361305663940687,,TRUE,TRUE,TRUE,,FALSE,Griffin Property Management,,Grill / Cooking Station  Seating Area  Shed / Storage box  Artwork / Sculptures,Rain collection system ( rain barrels  cisterns)  Hose connected to private property,Community Garden,,Collective,
TUCC George Washington Carver Garden,443 W 95th St,TRUE,Chicago IL,443 W 95th St Chicago IL,41.7212906,-87.6344363,"[41.7212906,-87.6344362999999]",21,CHICAGO,4,,www.trinitychicagoblog.org,,,,TRUE,TRUE,TRUE,,FALSE,,,Compost System  Seating Area  Shed / Storage box  Educational Signage,Rain collection system ( rain barrels  cisterns)  Hose connected to private property,Community Garden  Congregation Garden,,Collective,
,410 W 88th St,TRUE,Chicago IL,410 W 88th St Chicago IL,41.734948,-87.634221,"[41.734948,-87.634221]",21,AUBURN GRESHAM,4,,,,,,TRUE,TRUE,TRUE,,FALSE,,,,,Community Garden  Community Farm,,Allotment,
Fort Dearborn Elementary School,9025 S Throop St Chicago IL,FALSE,,9025 S Throop St Chicago IL,41.7299334,-87.6550042,"[41.7299334,-87.6550042]",21,CHICAGO,4,Chicago Public Schools,,,,The Kitchen Community,TRUE,FALSE,TRUE,FALSE,FALSE,,,Artwork / Sculptures  Seating Area  Teaching Area  Handicap accessible bed  Covered Area,Irrigation System  On site water source,School Garden,FALSE,,
Gresham School (Walter Q.),8524 S Green St Chicago IL,FALSE,,8524 S Green St Chicago IL,41.7387041,-87.6453953,"[41.7387041,-87.6453952999999]",21,AUBURN GRESHAM,4,,,,,,,,FALSE,FALSE,FALSE,,,,,School Garden  Ornamental / Beautification,FALSE,,
Jackson Elementary School (Mahalia),917 W 88th Street Chicago IL,FALSE,,917 W 88th Street Chicago IL,41.7338625,-87.6468801,"[41.7338625,-87.6468800999999]",21,AUBURN GRESHAM,4,Chicago Public Schools,,,,The Kitchen Community,TRUE,FALSE,TRUE,FALSE,FALSE,,,Teaching Area  Handicap accessible bed  Artwork / Sculptures  Covered Area  Seating Area,Irrigation System  On site water source,School Garden,FALSE,,
Simeon Career Academy High School (Neal F.),8147 S Vincennes Ave Chicago IL,FALSE,,8147 S Vincennes Ave Chicago IL,41.7455554,-87.6345246,"[41.7455554,-87.6345245999999]",21,CHATHAM,4,Chicago Public Schools,,,,The Kitchen Community,FALSE,FALSE,TRUE,FALSE,FALSE,,,Artwork / Sculptures  Covered Area  Seating Area  Teaching Area  Handicap accessible bed,Irrigation System  On site water source,School Garden,FALSE,,
Turner-Drew Language Academy,9300 S Princeton Ave,TRUE,Chicago IL,9300 S Princeton Ave Chicago IL,41.7257236,-87.6304858,"[41.7257235999999,-87.6304858]",21,ROSELAND,4,,,,,,,,FALSE,FALSE,FALSE,,,,,School Garden,FALSE,,
One Straw Garden,3337 W Douglas Blvd,TRUE,Chicago IL,3337 W Douglas Blvd Chicago IL,41.862138,-87.709403,"[41.862138,-87.709403]",24,NORTH LAWNDALE,2,,,,,,FALSE,FALSE,TRUE,,FALSE,,,Compost System  Water Management,No apparent water source,Community Garden  Orchard,,Collective,
Troy Community Garden,1842 S Troy St,TRUE,Chicago IL,1842 S Troy St Chicago IL,41.85599,-87.7044456,"[41.85599,-87.7044456]",24,NORTH LAWNDALE,2,NeighborSpace,http://neighbor-space.org/2012/04/21/1800-south-troy-block-club-garden/,,,,TRUE,TRUE,TRUE,,FALSE,,,Compost System  Seating Area,On site water source,Community Garden  Ornamental / Beautification,,Unclear,
African Heritage Garden,1241 S Central Park,TRUE,Chicago IL,1241 S Central Park Chicago IL,41.865024,-87.715016,"[41.865024,-87.7150159999999]",24,NORTH LAWNDALE,2,NeighborSpace,http://neighbor-space.org/2011/05/19/african-heritage-garden/,,,,TRUE,TRUE,TRUE,,FALSE,,,Compost System  Seating Area  Shed / Storage box  Artwork / Sculptures  Covered Area,On site water source,Community Garden,,Collective,
Avers Community Garden,2200 S Avers Ave,TRUE,Chicago IL,2200 S Avers Ave Chicago IL,41.8516064,-87.7211122,"[41.8516064,-87.7211122]",24,NORTH LAWNDALE,2,,,,,,TRUE,TRUE,TRUE,,FALSE,,,Seating Area  Play Area  Performance Area  Shed / Storage box  Artwork / Sculptures  Gazebo,Rain collection system ( rain barrels  cisterns)  Hose connected to private property,Community Garden  Ornamental / Beautification,,Collective,
Bay Bay's Peace Garden,3407 W 16th St,TRUE,Chicago IL,3407 W 16th St Chicago IL,41.8588946,-87.7106309,"[41.8588946,-87.7106309]",24,NORTH LAWNDALE,2,,http://loudgradeproducesquad.org/locations/chicago/homan-16th,,https://www.facebook.com/LoudGradePS,,FALSE,FALSE,TRUE,,FALSE,Loud Grade Produce Squad,,Compost System  Educational Signage,Rain collection system ( rain barrels  cisterns),Community Garden,,Collective,
Better Boys Foundation,1512 S Pulaski Rd  Chicago  IL 60623  USA,FALSE,,1512 S Pulaski Rd  Chicago  IL 60623  USA,41.8603857,-87.725477,"[41.8603856999999,-87.725477]",24,NORTH LAWNDALE,2,,http://www.betterboys.org/,,https://www.facebook.com/Better.Boys.Foundation,,TRUE,FALSE,TRUE,,FALSE,Better Boys Foundation,,Compost System,Hose connected to private property,Demo / Training / Program,,Collective,
CCA Student Academy Garden (Youth Connection Charter School),1242 S Harding Ave,TRUE,Chicago IL,1242 S Harding Ave Chicago IL,41.8648693,-87.7243496,"[41.8648693,-87.7243496]",24,NORTH LAWNDALE,2,Private,http://ccaacademy.org/,CCA Academy 773-762-2272,,,TRUE,TRUE,TRUE,,FALSE,CCA Student Academy  Youth Connection Charter School,Greenhouse,Shed / Storage box  Electricity Outlet  Artwork / Scultptures,Hose connected to private property,Community Garden  Demo / Training / Program  Ornamental / Beautification  Habitat / Conservation / Prairie  School Garden,TRUE,Collective,
Central Park Community Garden,2100 S Central Park Ave,TRUE,Chicago IL,2100 S Central Park Ave Chicago IL,41.8533508,-87.7153561,"[41.8533508,-87.7153561]",24,NORTH LAWNDALE,2,NeighborSpace,http://neighbor-space.org/2011/05/19/2100-south-central-park-block-club-garden/,,,,TRUE,FALSE,TRUE,,FALSE,,,Seating Area,On site water source,Community Garden  Ornamental / Beautification,,Unclear,
Crystal's Peace Garden,3852 W Polk St,TRUE,Chicago IL,3852 W Polk St Chicago IL,41.8709983,-87.7224444,"[41.8709983,-87.7224444]",24,CHICAGO,2,NeighborSpace,http://neighbor-space.org/2011/05/19/crystals-peace-garden/,,,NeighborSpace  NeighborSpace  NeighborSpace  Greencorps Chicago  Greencorps Chicago  Chicago Park District,TRUE,TRUE,TRUE,TRUE,FALSE,,,Seating Area  Seating Area  Compost System,On site water source,Community Garden  Ornamental / Beautification,TRUE,Unclear,
Garden of Hope,2131 S St Louis Ave,TRUE,Chicago IL,2131 S St Louis Ave Chicago IL,41.8526051,-87.7120822,"[41.8526051,-87.7120822]",24,NORTH LAWNDALE,2,,www.westlawnyouthnetwork.org,,https://www.facebook.com/pages/Westlawn-Youth-Network/155553694964,,TRUE,FALSE,TRUE,,FALSE,Westlawn Gospel Chapel,,Compost System  Seating Area  Gazebo,Hose connected to private property,Community Garden  Food Donation  Congregation Garden  Ornamental / Beautification,,Collective,
Lawndale Community Church Garden,3810 Ogden Ave,TRUE,Chicago IL,3810 Ogden Ave Chicago IL,41.853028,-87.7204151,"[41.8530279999999,-87.7204151]",24,NORTH LAWNDALE,2,,http://www.lawndalechurch.org/,,https://www.facebook.com/lawndalecommunitychurch,,TRUE,FALSE,TRUE,,FALSE,Lawndale Community Church,,Seating Area,Hose connected to private property,Community Garden  Food Donation  Congregation Garden,,Collective,
1900 S. Ridgeway Enabling Garden,1900 S Ridgeway Ave,TRUE,Chicago IL,1900 S Ridgeway Ave Chicago IL,41.8548221,-87.7191399,"[41.8548221,-87.7191399]",24,NORTH LAWNDALE,2,NeighborSpace,http://neighbor-space.org/2011/05/19/1900-s-ridgeway-enabling-garden-2/,,https://www.facebook.com/nlgreeningcommittee?ref=br_tf,NeighborSpace,TRUE,FALSE,TRUE,,FALSE,North Lawndale Greening Committee,,Seating Area  Gazebo,On site water source,Community Garden,,Collective,
MLK District Garden,3732 W 16th St  Chicago  IL  60623,FALSE,,3732 W 16th St  Chicago  IL  60623,41.859116,-87.719223,"[41.859116,-87.719223]",24,NORTH LAWNDALE,2,NeighborSpace,,,,,FALSE,FALSE,TRUE,TRUE,FALSE,,,Shed / Storage box  Seating Area,Hose connected to private property,Community Garden  Food Donation,,Collective,
Operation Brotherhood Serenity Garden,3745 W Ogden Ave,TRUE,Chicago IL,3745 W Ogden Ave Chicago IL,41.852792,-87.7190895,"[41.852792,-87.7190895]",24,NORTH LAWNDALE,2,,,,,,TRUE,TRUE,FALSE,,TRUE,Operation Brotherhood,,,,Community Garden,,Collective,
